ID,CaseTitle,InitiationYear,ResolutionYear,RespondentState,ClaimantCountry,ClaimantName,PAULSSON,ArbitrationRules,LegalInstrument,OutcomeStatus,amountSought,amountSought_original,amountAwarded,amountAwarded_original,Arbitrator1,Arbitrator1President,Arbitrator2,Arbitrator2Claimant,Arbitrator3,Arbitrator3Respondent,description,italaw
UNC221,Oxus Gold v. Kyrgyz Republic,2006,2008,Kyrgyzstan,United Kingdom,Oxus Gold,Gold mining,UNCITRAL,Kyrgyz Republic-United Kingdom BIT,Settled,739800000,630000000,unknown,,Francisco ORREGO VICUÑA,yes,Charles N. BROWER,yes,Pierre-Marie DUPUY,yes,"United Kingdom gold company Oxus opted for arbitration in 2006, complaining that government officials illegally revoked an operating permit for the Jerooy gold project. Government officials countered that Oxus was not living up to the terms of its contract. The case settled in mid-2008, some months after an unpublished jurisdictional ruling paved the way for arbitrators to examine the merits of Oxus’s claim.",Not found
UNC236,Merrill & Ring Forestry L.P. v. The Government of Canada,2006,,Canada,USA,Merrill & Ring Forestry L.P.,,UNCITRAL,NAFTA,In favour of the State,29357142.86,25000000,Not applicable,,Francisco ORREGO VICUÑA,yes,J. William ROWLEY,yes,Kenneth Dam,yes,,
UNC437,Club Hotel Loutraki S.A. and Casinos Austria International Holding GMBH v. Serbia (ICSID Case No. ARB/11/4),2011,2012,Serbia,Greece/Austria,Club Hotel Loutraki S.A. and Casinos Austria International Holding GMBH,Operation of gaming and entertainment facilities,ICSID,Austria-Serbia BIT (2001); Greece-Serbia BIT,Settled,157866799.4,150000000,unknown,,Francisco ORREGO VICUÑA,yes,Horacio A. GRIGERA NAÓN,yes,Jernej SEKOLEC,yes,,
UNC124,Eureko B.V. v. Poland,2003,2009,Poland,Netherlands,Eureko B.V.,,UNCITRAL,Netherlands-Poland BIT,Settled,12868884540,10000000000,unknown,,L. Yves FORTIER,yes,"Schwebel, S. M.",yes,"Rajski, J.",yes,"A dispute arising from the privatization of Poland’s largest insurer, PZU S.A. Arbitration was initiated in 2003 by the Dutch insurer Eureko B.V., which was frustrated by Poland’s refusal to bring PZU public, or to let Eureko acquire control. Eureko, which was PZU’s largest private shareholder, claimed that it was entitled to acquire control over PZU under a 1999 share purchase agreement and a 2001 addendum. In August 2005 the tribunal held Poland liable for violating the “umbrella clause” of its investment treaty with Netherlands, as well as its provisions on fair and equitable treatment and expropriation. The case settled in autumn 2009, before the arbitrators could rule on damages. The settlement cleared the way for PZU to go public in April 2010 and for Eureko to sell its stake to financial investors in November for $1.4 billion.",http://www.italaw.com/cases/412
UNC053,ADF Group Inc. v. USA (ICSID Case No. ARB(AF)/00/1),2000,2003,USA,Canada,ADF Group Inc.,Highway construction project,ICSID AF,NAFTA,In favour of the State,,,Not applicable,,Florentino P. FELICIANO,yes,Armand DE MESTRAL,yes,Carolyn B. LAMM,yes,,
UNC070,SGS Société Générale de Surveillance S.A. v. Islamic Pakistan (ICSID Case No. ARB/01/13),2001,2004,Pakistan,Switzerland,SGS Société Générale de Surveillance S.A.,Service agreement,ICSID,Pakistan-Switzerland BIT,Settled,,,unknown,,Florentino P. FELICIANO,yes,André J.E. FAURÈS,yes,J. Christopher THOMAS,yes,"The Swiss firm SGS contracted to provide port services for Pakistan. Under a novel theory, SGS tried to recover for contract breaches under investment treaties. In February 2004 the Pakistani tribunal asserted jurisdiction only over BIT claims. In a spring 2004 settlement the parties agreed to withdraw their claims against each other and to continue doing business together. As part of the settlement, SGS paid $2 million of Pakistan’s fees, and admitted to breaches of its internal controls; the Pakistani press reported that former SGS employees had paid bribes to obtain the contract.",
UNC227,"Azpetrol International Holdings B.V., Azpetrol Group B.V. and Azpetrol Oil Services Group B.V. v. Azerbaijan (ICSID Case No. ARB/06/15)",2006,2009,Azerbaijan,Netherlands,"Azpetrol International Holdings B.V., Azpetrol Group B.V. and Azpetrol Oil Services Group B.V.","Oil and gas distribution, trade, storage and transportation enterprise",ICSID,Energy Charter Treaty,In favour of the State,352285714.3,300000000,Not applicable,,Florentino P. FELICIANO,yes,Charles N. BROWER,yes,Christopher Greenwood,yes,"Oil and gas distribution, trade, storage and transportation enterprises",http://www.italaw.com/cases/116
UNC230,Romak S.A. v. The Uzbekistan (PCA Case No. AA280),2006,2009,Uzbekistan,Switzerland,Romak S.A.,grain sales contract,UNCITRAL,Switzerland-Uzbekistan BIT,In favour of the State,,,Not applicable,,Fernando Mantilla-Serrano,,Noah Rubins,yes,Nicolas Molfessis,yes,,http://www.italaw.com/cases/918
UNC072,"AIG Capital Partners, Inc. and CJSC Tema Real Estate Company v. Kazakhstan (ICSID Case No. ARB/01/6)",2001,2003,Kazakhstan,USA,"AIG Capital Partners, Inc. and CJSC Tema Real Estate Company",Construction of residential housing complex,ICSID,Kazakhstan-United States BIT,In favour of the investor,,,11968062.62,9300000,Fali S. NARIMAN,yes,Piero BERNARDINI,yes,Branko Vukmir,yes,,
UNC062,"F-W Oil Interests, Inc. v. Trinidad & Tobago (ICSID Case No. ARB/01/14)",2001,2006,Trinidad and Tobago,USA,"F-W Oil Interests, Inc.",Oil and gas development contract,ICSID,Trinidad and Tobago-United States BIT,In favour of the State,,,Not applicable,,Fali S. NARIMAN,yes,Franklin BERMAN,yes,Michael MUSTILL,yes,"FW Oil, a Houston wildcatter, alleges that Trinidad and Tobago withdrew a contract that it had been awarded, for the regeneration of the Soldado oil and gas fields on the marine border between Trinidad and Venezuela.",
UNC137,RGA Reinsurance Company v. Argentine Republic (ICSID Case No. ARB/04/20),2004,2006,Argentina,USA,RGA Reinsurance Company,Financial reinsurance services,ICSID,Argentina-United States BIT,Settled,,,unknown,,Fali S. NARIMAN,yes,Piero BERNARDINI,yes,Georges ABI-SAAB,yes,,
UNC177,Wintershall Aktiengesellschaft v. Argentine Republic (ICSID Case No. ARB/04/14),2004,2008,Argentina,Germany,Wintershall Aktiengesellschaft,Gas and oil production,ICSID,Argentina-Germany BIT,In favour of the State,357171837,285000000,Not applicable,,Fali S. NARIMAN,yes,Santiago TORRES BERNÁRDEZ,yes,Piero BERNARDINI,yes,"Wintershall hoped to number amongst the dozens of foreign investors to sue over emergency measures taken during the Argentine financial crisis of the early 2000s. However, in December 2008, a panel of ICSID arbitrators declined jurisdiction over the claim. Arbitrators ruled that Wintershall failed to turn to the local courts for a minimum of 18 months—as required under the Germany–Argentina BIT—and that the claimant could not avoid this requirement by invoking the BIT’s Most-Favoured Nation (MFN) clause and seeking fast-track arbitration options contained in other treaties concluded by Argentina.",
UNC141,"Grand River Enterprises Six Nations, Ltd., et.al. v. USA",2004,2011,USA,Canada,"Grand River Enterprises Six Nations, Ltd., et.al.",tobacco,UNCITRAL,NAFTA,In favour of the State,426099735.3,340000000,Not applicable,,Fali Nariman,yes,James Anaya,yes,John Crook,yes,"Canadians allege that the USA tobacco settlement sent their profits up in smoke. The claimants turned to NAFTA arbitration in 2003, following a so-called Master Settlement Agreement (MSA) reached among 46 USA states and four major tobacco companies. While the MSA ended various lawsuits against tobacco companies, the Canadian claimants say that it led to onerous new consequences for smaller operators in the tobacco sector. The USA government argues that several of the claimants lack cross-border investments, and are better described as cross-border traders—who would not have standing to sue the USA under the NAFTA investment chapter. Hearings are slated for later in 2009.",http://www.italaw.com/cases/510
UNC109,Camuzzi International S.A. v. Argentine Republic (ICSID Case No. ARB/03/7) (II),2003,2007,Argentina,Luxembourg,Camuzzi International S.A.,Electricity distribution and transportation enterprise,ICSID,Argentina-Belgium and Luxembourg BIT,Settled,289549902.2,225000000,unknown,,Enrique GÓMEZ-PINZÓN,yes,Henri C. ÁLVAREZ,yes,Héctor GROS ESPIELL,yes,"Camuzzi pulled the plug on its arbitration before arbitrators could rule on the merits. The company complained that it had been harmed by Argentina’s emergency response to an earlier financial crisis. However, Camuzzi later struck an agreement with the government permitting it to raise tariffs on its Argentine gas distribution business.",
UNC453,Highbury International AVV and Ramstein Trading Inc. v. Venezuela (ICSID Case No. ARB/11/1),2011,2013,Venezuela,Netherlands/Panama,Highbury International AVV and Ramstein Trading Inc.,Mining concession,ICSID,Netherlands-Venezuela BIT,In favour of the State,666197893.7,633000000,Not applicable,,Enrique BARROS BOURIE,yes,Guido Santiago TAWIL,yes,Claus VON WOBESER,yes,,http://www.italaw.com/cases/2250
UNC502,Valle Verde Sociedad Financiera S.L. v. Venezuela (ICSID Case No. ARB/12/18),2012,,Venezuela,Spain,Valle Verde Sociedad Financiera S.L.,Banking enterprise,ICSID,Spain-Venezuela BIT,Pending,,,Not applicable,,Enrique BARROS BOURIE,yes,Franco FERRARI,yes,Raúl E. VINUESA,yes,,
UNC262,Saba Fakes v. Turkey (ICSID Case No. ARB/07/20),2007,2010,Turkey,Netherlands,Saba Fakes,Mobile telecommunications services,ICSID,Netherlands-Turkey BIT,In favour of the State,21693549787,19000000000,Not applicable,,Emmanuel GAILLARD,yes,Hans VAN HOUTTE,yes,Laurent LÉVY,yes,"One of a series of arbitrations filed against Turkey in the aftermath of criminal and fraud allegations leveled against members of the Uzan family. Fakes, a Jordanian-Dutch binational, claimed to have acquired control of Telsim, the second-largest Turkish telecom, one day before the company was seized by Turkish authorities. In July 2010 the tribunal declined jurisdiction, finding that Fakes had never intended to buy the shares in the telecom company, and ordering him to pay Turkey’s full legal costs.",http://www.italaw.com/cases/429
UNC017,Metalclad Corporation v. The United Mexican States (ICSID Case No. ARB(AF)/97/1),1997,2000,Mexico,USA,Metalclad Corporation,Waste disposal enterprise,ICSID AF,NAFTA,In favour of the investor,,,23371149.83,17000000,Elihu LAUTERPACHT,yes,Benjamin R. CIVILETTI,yes,José Luis SIQUEIROS,yes,,
UNC028,Joseph Charles Lemire v. Ukraine (ICSID Case No. ARB(AF)/98/1),1998,2000,Ukraine,USA,Joseph Charles Lemire,Radio broadcasting enterprise,ICSID AF,Ukraine-United States BIT,Settled,145236809.8,100000000,unknown,,Elihu LAUTERPACHT,yes,Jan PAULSSON,yes,Jürgen VOSS,yes,,
UNC526,South American Silver Limited v. The Plurinational State of Bolivia (PCA Case No. 2013-15),2013,,Bolivia,Bermuda,South American Silver Limited,mining,UNCITRAL,Bolivia-United Kingdom BIT,Pending,unknown,,Not applicable,,Eduardo Zuleta Jaramillo,yes,Francisco ORREGO VICUÑA,yes,Osvaldo César Guglielmino,yes,,http://www.italaw.com/cases/2121
UNC348,"Iberdrola Energía, S.A. v. Guatemala (ICSID Case No. ARB/09/5)",2009,2012,Guatemala,Spain,"Iberdrola Energía, S.A.",Electricity distribution concession,ICSID,Guatemala-Spain BIT,In favour of the State,204142688.7,185000000,Not applicable,,Eduardo ZULETA,yes,Yves DERAINS,yes,Rodrigo OREAMUNO,yes,,
UNC479,Telefónica S.A. v. United Mexican States (ICSID Case No. ARB(AF)/12/4),2012,,Mexico,Spain,Telefónica S.A.,Telecommunications services,ICSID AF,Spain-Mexico BIT,Pending,,,Not applicable,,Eduardo ZULETA,yes,Horacio A. GRIGERA NAÓN,yes,Ricardo RAMÍREZ HERNÁNDEZ,yes,,
UNC518,"Valores Mundiales, S.L. and Consorcio Andino S.L. v. Bolivarian Venzuela (ICSID Case No. ARB/13/11)",2013,,Venezuela,Spain,"Valores Mundiales, S.L. and Consorcio Andino S.L.",Food products enterprise,ICSID,Spain-Venezuela BIT,Pending,,,Not applicable,,Eduardo ZULETA,yes,Horacio A. GRIGERA NAÓN,yes,Yves Derains,yes,,
UNC553,"Poštová banka, a.s. and ISTROKAPITAL SE v. Hellenic Republic (ICSID Case No. ARB/13/8)",2013,2015,Greece,Cyprus/Slovakia,"Poštová banka, a.s. and ISTROKAPITAL SE",Debt instruments,ICSID,Czech Republic-Greece BIT; Cyprus-Greece BIT,In favour of the State,,,Not applicable,,Eduardo ZULETA,yes,John M. TOWNSEND,yes,Brigitte STERN,yes,"In May 2013, Slovak and Cypriot investors sued Greece for the 2012 debt swap which Athens had to negotiate with its creditors to get bailout money from the EU and the International Monetary Fund ",
UNC558,Antin Infrastructure Services Luxembourg S.à.r.l. and Antin Energia Termosolar B.V. v. Kingdom of Spain (ICSID Case No. ARB/13/31),2013,,Spain,Luxembourg/Netherlands,Antin Infrastructure Services Luxembourg S.à.r.l. and Antin Energia Termosolar B.V.,Renewable energy generation enterprise,ICSID,Energy Charter Treaty,Pending,unknown,,Not applicable,,Eduardo ZULETA,yes,Francisco ORREGO VICUÑA,yes,J. Christopher THOMAS,yes,Claim arising in response to reform of renewable energy policy,
UNC339,Konsortium Oeconomismus v. Czech Republic,2009,2012,Czech Republic,Switzerland,Konsortium Oeconomismus,incineration plant,Data not available,Czech Republic-Switzerland BIT,In favour of the State,286903238.1,260000000,Not applicable,,Eduardo SILVA ROMERO,yes,Andreas Ueltzhöffer,yes,Sabine Konrad,yes,"The Swiss company has initiated the arbitral procededings against the Czech Republic because of a loan in the amount of CZK 710 million, which the investor provided to the company ECO Gaia for the construction of an incineration plant in the Southwest of the Czech Republic. Eco Gaia has, however, made no progress in the construction and has declared itself bankrupt. ",http://www.italaw.com/cases/1185
UNC570,Alpiq AG v. Romania (ICSID Case No. ARB/14/28),2014,,Romania,Switzerland,Alpiq AG,Electricity generation and distribution operations,ICSID,Romania-Switzerland BIT; Energy Charter Treaty,Pending,,,Not applicable,,Eduardo SILVA ROMERO,yes,Klaus SACHS,yes,Mark A. CLODFELTER,yes,,
UNC478,Serafín García Armas and Karina García Gruber v. The Venezuela (PCA Case No. 2013-3),2012,,Venezuela,Spain,Serafín García Armas and Karina García Gruber,food,UNCITRAL,Spain-Venezuela BIT,Pending,41244283.39,40000000,Not applicable,,Eduardo Grebler,yes,Guido Santiago TAWIL,yes,Rodrigo OREAMUNO,yes,,http://www.italaw.com/cases/2869
UNC047,United Kingdom Bank v. Russia,2000,DU,Russia,United Kingdom,United Kingdom Bank,financial services,SCC,Russia-United Kingdom BIT,Settled,unknown,,unknown,,DU,,DU,,DU,,DU,Not found
UNC063,"Billy Joe Adams, Juan Alarcon, Roberto Alonzo et al. v. United Mexican States",2001,,Mexico,USA,"Billy Joe Adams, Juan Alarcon, Roberto Alonzo et al.",vacation properties,UNCITRAL,NAFTA,Discontinued (for unknown reasons or reasons other than settlement),,,,,DU,,DU,DU,DU,,,
UNC140,"Offshore Power Production C.V., Travamark Two B.V., EFS India-Energy B.V., Enron B.V., and Indian Power Investments B.V. v. India",2004,2005,India,Netherlands,"Offshore Power Production C.V., Travamark Two B.V., EFS India-Energy B.V., Enron B.V., and Indian Power Investments B.V.",power plant,UNCITRAL,India-Netherlands BIT,Settled,5012938062,4000000000,unknown,,DU,yes,Marc LALONDE,Data not available,Lord Cooke of Thorndon,Data not available,"A BIT dispute flowing from the massive but mothballed Dabhol power project, built in Mumbai by General Electric Company, Bechtel Group, Inc., and Enron Corp. GE and Bechtel purchased Enron’s stake in early 2003. After their contract arbitration bogged down in domestic court challenges by the Indian respondents, GE and Bechtel filed this BIT claim against India in the name of Enron’s Netherlands affiliates. The amount in dispute corresponds to Enron’s majority share of the project.",None
UNC295,Czechoslonor AS v. Czech Republic,2008,,Czech Republic,Norway,Czechoslonor AS,fisheries company,Data not available,Czech Republic-Norway BIT,Data not available,,,unknown,,DU,,DU,,DU,,"A salmon-processing plant went bankrupt after the bank withdrew a loan, based on allegedly fictitious police report. The investor was deprived of the plant. ",
UNC306,Georg Nepolsky v. Czech Republic,2008,2010,Czech Republic,Germany,Georg Nepolsky,water,UNCITRAL,Czech Republic-Germany BIT,Discontinued (for unknown reasons or reasons other than settlement),,,unknown,,DU,,DU,,DU,,Claims filed by Mr. Nepolsky over frustrations related to his plans to extract mineral water from a source under the land surface of a property he was in possession of.,http://www.italaw.com/cases/743
UNC517,CSP Equity Investment Sarl v. Kingdom of Spain,2013,,Spain,Luxembourg,CSP Equity Investment Sarl,,SCC,Energy Charter Treaty,Pending,,,Not applicable,,DU,,DU,,DU,,Claim arising in response to reform of renewable energy policy,http://www.italaw.com/cases/2303
UNC572,"J.M. Longyear, LLC v. Government of Canada",2014,,Canada,USA,"J.M. Longyear, LLC",forestry,UNCITRAL,NAFTA,Pending,12000000,12000000,Not applicable,,DU,,DU,,DU,,,http://www.italaw.com/cases/2581
UNC573,"David R. Aven, Samuel D. Aven, Carolyn J. Park, Eric A. Park, Jeffrey S. Shioleno, Giacomo A. Buscemi, David A. Janney and Roger Raguso v. The Costa Rica",2014,,Costa Rica,USA,"David R. Aven, Samuel D. Aven, Carolyn J. Park, Eric A. Park, Jeffrey S. Shioleno, Giacomo A. Buscemi, David A. Janney and Roger Raguso",tourism,UNCITRAL,CAFTA,Pending,70000000,70000000,Not applicable,,DU,,DU,,DU,,,http://www.italaw.com/cases/2959
UNC574,Cem Uzan v. Turkey,2014,,Turkey,Cyprus,Cem Uzan,Electricity generation and distribution operations,SCC,Energy Charter Treaty,Pending,,,Not applicable,,DU,,DU,,DU,,Electricity generation and distribution concessions (expropriation),
UNC583,Vodafone International Holdings BV v. India,2014,,India,Netherlands,Vodafone International Holdings BV,telecom,UNCITRAL,India-Netherlands BIT,Pending,,,Not applicable,,DU,,L. Yves FORTIER,yes,Ramesh Chanda Lahoti,yes,,http://www.italaw.com/cases/2544
UNC585,Red Eléctrica Internacional S.A.U. v. Plurinational State of Bolivia,2014,,Bolivia,Spain,Red Eléctrica Internacional S.A.U.,electric power distribution,UNCITRAL,Bolivia-Spain BIT,Settled,,,unknown,,DU,,DU,,DU,,,
UNC588,RWE Innogy GmbH and RWE Innogy Aersa S.A.U. v. Kingdom of Spain (ICSID Case No. ARB/14/34),2014,,Spain,Germany,RWE Innogy GmbH and RWE Innogy Aersa S.A.U.,Renewable energy generation enterprise,ICSID,Energy Charter Treaty,Pending,unknown,,Not applicable,,DU,,DU,,DU,,,Not found
UNC604,"Ansung Housing Co., Ltd. v. China (ICSID Case No. ARB/14/25)",2014,,China,Korea,"Ansung Housing Co., Ltd.",Property development project,ICSID,China-Korea BIT (2007),Pending,16200000,16200000,Not applicable,,DU,,DU,,DU,,,
UNC629,Sana Consulting v. Russia,2012,2015,Russia,Germany,Sana Consulting,DU,UNCITRAL,Russia-Germany BIT,In favour of the State,30933212.54,30000000,Not applicable,,DU,,DU,,DU,,,iareporter
UNC147,Eastern Sugar B.V. v. The Czech Republic (SCC Case No. 088/2004),2004,2007,Czech Republic,Netherlands,Eastern Sugar B.V.,agricultural investment,UNCITRAL,Czech Republic-Netherlands BIT,In favour of the investor,141740823.7,113100000,39961802.24,35000000,Dr. Pierre A. Karrer,yes,Robert VOLTERRA,yes,Emmanuel GAILLARD,yes,"27 March 2007, the ad hoc arbitral tribunal held that Eastern Sugar, a Dutch investor, was discriminated against when Czech officials reduced its domestic sugar production quotas as part of the Republic’s accession to the EU. This constituted a breach of the “fair and equitable treatment” provision imposed by the BIT. In reaching this conclusion, it did not allow the Czech Republic to rely on EU or domestic law to justify its breaches of the BIT.  The government argued that the arbitral tribunal did not have jurisdiction since their BIT with the Netherlands was no longer valid, had been superseded by EU Law and should ultimately be decided by the European Court of Justice.",http://www.italaw.com/cases/368
UNC497,Mr. Yosef Maiman and others v. Egypt,2012,,Egypt,Poland,Mr. Yosef Maiman and others,gas,UNCITRAL,Egypt-Poland BIT,Pending,1031107085,1000000000,Not applicable,,Donald McRae,yes,W. Michael Reisman,yes,J. Christopher THOMAS,yes,"The second of the two treaty challenges brought by investors in East Mediterranean Gas Company to the 2011 termination of Egypt’s natural gas deal with Israel. The lead claimant in this dispute, Yosef Maiman, is the chair of East Mediterranean shareholder Ampal-American Israel Corporation. An Israeli businessman with Polish origins, Maiman brings a claim under the Egypt-Poland investment treaty. Other claimants invoke the Egypt-United Kingdom treaty. Egypt responds that this is a disguised contract arbitration, arising exclusively out of an agreement that was signed by none of the parties to the arbitration.",http://www.italaw.com/cases/2034
UNC261,Europe Cement Investment and Trade S.A. v. Turkey (ICSID Case No. ARB(AF)/07/2),2007,2009,Turkey,Poland,Europe Cement Investment and Trade S.A.,Electricity concessions,ICSID AF,Energy Charter Treaty,In favour of the State,4338709957,3800000000,Not applicable,,Donald M. McRAE,yes,Julian D.M. LEW,yes,Laurent LÉVY,yes,Electricity concession,
UNC409,Indorama International Finance Limited v. Arab Egypt (ICSID Case No. ARB/11/32),2011,2015,Egypt,United Kingdom,Indorama International Finance Limited,Textile enterprise,ICSID,Egypt-United Kingdom BIT,Pending,126293439.6,120000000,Not applicable,,Donald M. McRAE,yes,Christoph H. SCHREUER,yes,Zachary DOUGLAS,yes,,
UNC442,Türkiye Petrolleri Anonim Ortaklığı v. Kazakhstan (ICSID Case No. ARB/11/2),2011,2014,Kazakhstan,Turkey,Türkiye Petrolleri Anonim Ortaklığı,Oil exploration and production joint venture,ICSID,Kazakhstan-Turkey BIT; Energy Charter Treaty,Settled,526222664.8,500000000,unknown,,Donald M. McRAE,yes,Charles N. BROWER,yes,Brigitte STERN,yes,,
UNC568,NextEra Energy Global Holdings B.V. and NextEra Energy Spain Holdings B.V. v. Kingdom of Spain (ICSID Case No. ARB/14/11),2014,,Spain,Netherlands,NextEra Energy Global Holdings B.V. and NextEra Energy Spain Holdings B.V.,Renewable energy generation enterprise,ICSID,Energy Charter Treaty,Pending,unknown,,Not applicable,,Donald M. McRAE,yes,L. Yves FORTIER,yes,Laurence BOISSON DE CHAZOURNES,yes,Claim arising in response to reform of renewable energy policy,
UNC571,"Ioan Micula, Viorel Micula and others v. Romania (ICSID Case No. ARB/14/29) (II)",2014,,Romania,Sweden,"Ioan Micula, Viorel Micula and others",Beverage production enterprises,ICSID,Romania-Sweden BIT,Pending,,,Not applicable,,Donald M. McRAE,yes,Michael C. PRYLES,yes,John R. CROOK,yes,,
UNC369,"China Heilongjiang International Economic & Technical Cooperative Corp., Beijing Shougang Mining Investment Company Ltd., and Qinhuangdaoshi Qinlong International Industrial Co. Ltd. v. Mongolia",2010,,Mongolia,China,"China Heilongjiang International Economic & Technical Cooperative Corp., Beijing Shougang Mining Investment Company Ltd., and Qinhuangdaoshi Qinlong International Industrial Co. Ltd.",mining company,UNCITRAL,China-Mongolia BIT,Pending,542833033.7,500000000,Not applicable,,Donald Donovan,yes,Mark Clodfelter,,Yas BANIFATEMI,,,http://www.italaw.com/cases/279
UNC400,Energoalians SARL v. the Moldova,2010,2013,Moldova,United Kingdom,Energoalians SARL,Supply of electricity,UNCITRAL,Energy Charter Treaty,In favour of the investor,75996624.72,70000000,43271743.78,42581000,Dominic Pellew,yes,Mikhail Savranski,yes,Victor Volcinski,yes,,http://www.italaw.com/cases/2579
UNC247,Alpha Projektholding GmbH v. Ukraine (ICSID Case No. ARB/07/16),2007,2010,Ukraine,Austria,Alpha Projektholding GmbH,Hotel development project,ICSID,Austria-Ukraine BIT,In favour of the investor,,,8935031.73,8230000,Davis R. ROBINSON,yes,Yoram A. TURBOWICZ,yes,Stanimir A. ALEXANDROV,yes,,
UNC274,Frontier Petroleum Services Ltd. v. The Czech Republic,2007,2010,Czech Republic,Canada,Frontier Petroleum Services Ltd.,oil and gas,UNCITRAL,Canada-Czech Republic BIT,In favour of the State,unknown,,Not applicable,,David Williams,yes,Henri Alvarez,yes,Christoph Schreuer,yes,,http://www.italaw.com/cases/459
UNC381,"Anatolie and Gabriel Stati, Ascom Group S.A., Terra Raf Trans Traiding Ltd v. Kazakhstan (SCC Case No. Case No. 116/2010)",2010,2013,Kazakhstan,Moldova/Romania/Gibraltar,"Anatolie and Gabriel Stati, Ascom Group S.A., Terra Raf Trans Traiding Ltd",Oil fields,SCC,Energy Charter Treaty,In favour of the investor,5428330337,5000000000,516240714,508000000,David Haigh,yes,Sergei Lebedev,yes,Karl-Heinz BÖCKSTIEGEL,yes,Oil field,http://www.italaw.com/cases/2358
UNC074,Aguas del Tunari S.A. v. Bolivia (ICSID Case No. ARB/02/3),2002,2006,Bolivia,Netherlands,Aguas del Tunari S.A.,Water and sewer services concession,ICSID,Bolivia-Netherlands BIT,Settled,,,unknown,,David D. CARON,yes,Henri C. ÁLVAREZ,yes,José Luis ALBERRO-SEMERENA,yes,,http://www.italaw.com/cases/57
UNC535,Vladislav Kim and others v. Uzbekistan (ICSID Case No. ARB/13/6),2013,,Uzbekistan,Kazakhstan,Vladislav Kim and others,Cement production enterprise,ICSID,Kazakhstan-Uzbekistan BIT,Pending,,,Not applicable,,David D. CARON,yes,L. Yves FORTIER,yes,Toby LANDAU,yes,,
UNC579,"Albaniabeg Ambient Sh.p.k, M. Angelo Novelli and Costruzioni S.r.l. v. Albania (ICSID Case No. ARB/14/26)",2014,,Albania,Italy,"Albaniabeg Ambient Sh.p.k, M. Angelo Novelli and Costruzioni S.r.l.",Waste management and renewable energy production project,ICSID,Energy Charter Treaty,Pending,unknown,,Not applicable,,David D. CARON,yes,John M. TOWNSEND,yes,Leonard HOFFMANN,yes,Waste management and renewable energy production project,
UNC623,Bryn Services Ltdv. Latvia,2013,2014,Latvia,Switzerland,Bryn Services Ltd,banking,,Switzerland-Latvia BIT,Settled,,,unknown,,David Caron,yes,David Roney,yes,J. Christopher THOMAS,yes,,iareporter
