ID,Case Title,Case Number,InvestmentType,Date Registered,Arbitrator1,Arbitrator1President,President Nationality,Arbitrator2,Arbitrator2Claimant,Arbitrators 1 Nationality,Arbitrator3,Arbitrator3Respondent,Arbitrator 2 Nationality,Claimant Representative,Respondent Representative,Outcome Of Proceeding,ResolutionYear
UNC101,Unisys Corporation v. Argentine Republic,ARB/03/27,Information storage and management project,2003-10-15,Juan FERNÁNDEZ-ARMESTO,YES,Spanish,Piero BERNARDINI,YES,Italian,Jean Paul CHABANEIX,YES,Peruvian,"Boies, Schiller & Flexner, Washington, D.C., U.S.A.","Procuradora del Tesoro de la Naci&oacuten, Buenos Aires, Argentina",,
UNC059,Antoine Goetz and others v. Republic of Burundi,ARB/01/2,Mining enterprise,1995-12-18,Prosper WEIL,YES,French,Mohammed BEDJAOUI,YES,Algerian,Jean-Denis BREDIN,YES,French,"Dominique Herbosch, Anvers, Belgium","Ministre de la justice, Bujumbura, Burundi","Settlement agreed by the parties and settlement recorded at their request in the form of an award (Award embodying the parties' settlement agreement rendered on February 10, 1999, pursuant to ICSID Arbitration Rule 43(2)).",1999
UNC437,Club Hotel Loutraki S.A. and Casinos Austria International Holding GMBH v. Republic of Serbia,ARB/11/4,Operation of gaming and entertainment facilities,2011-01-21,Francisco ORREGO VICUÑA,YES,Chilean,Horacio A. GRIGERA NAÓN,YES,Argentine,Jernej SEKOLEC,YES,Slovenian,"Arnold & Porter, Washington, D.C., U.S.A.","Public Attorney of the Republic of Serbia, Belgrade, Serbia","The Tribunal issues a procedural order taking note of the discontinuance of the proceeding pursuant to ICSID Arbitration Rule 44 on January 18, 2012.",2012
UNC126,"EDF International S.A., SAUR International S.A. and León Participaciones Argentinas S.A. v. Argentine Republic",ARB/03/23,Electricity distribution enterprise,2003-08-12,William W. PARK,YES,"Swiss, U.S.",Gabrielle KAUFMANN-KOHLER,YES,Swiss,Jesús REMÓN,YES,Spanish,"Arnold & Porter, Washington, D.C., U.S.A.","Procuradora del Tesoro de la Nación, Buenos Aires, Argentina","The Tribunal renders its award on June 11, 2012.",2012
UNC167,"Corn Products International, Inc. v. United Mexican States",ARB(AF)/04/1,Soft drink sweetener production enterprise,2004-01-26,Christopher GREENWOOD,YES,British,Andreas F. LOWENFELD,YES,U.S.,Jesus SERRANO DE LA VEGA,YES,Mexican,"Steptoe & Johnson, Washington, D.C., U.S.A.","Dirección General de Consultoría Jurídica de Negociaciones, Secretaría de Economía, Mexico City, Mexico Pillsbury, Winthrop, Shaw and Pittman, Washington, D.C. Thomas and Partners, Vancouver, Canada","Award rendered on August 18, 2009.",2009
UNC377,Renée Rose Levy de Levi v. Republic of Peru,ARB/10/17,Banking enterprise,2010-07-20,Rodrigo OREAMUNO,YES,Costa Rican,Bernard HANOTIAU,YES,Belgian,Joaquin MORALES GODOY,YES,Chilean,"Estudio Pait&aacuten & Abogados, Lima, Peru","Sidley Austin, Washington, D.C., U.S.A.","Award rendered on February 26, 2014, attached to the award is a dissenting opinion by arbitrator Joaquín Morales Godoy.",2014
UNC183,Ares International S.r.l. and MetalGeo S.r.l. v. Georgia,ARB/05/23,Steel industry project,2005-11-09,J. William ROWLEY,YES,"British, Canadian",Emmanuel GAILLARD,YES,French,John BEECHEY,YES,British,,,"Award rendered on February 28, 2008.",2008
UNC458,Apotex Holdings Inc. and Apotex Inc. v. United States of America,ARB(AF)/12/1,Pharmaceutical enterprise,2012-03-16,V.V. VEEDER,YES,British,J. William ROWLEY,YES,"British, Canadian",John R. CROOK,YES,U.S.,"Dentons, Paris, France and New York, NY, U.S.A.","United States Department of State, Washington, D.C., U.S.A.","Award rendered on August 25, 2014.",2014
UNC571,"Ioan Micula, Viorel Micula and others v. Romania",ARB/14/29,Beverage production enterprises,2014-11-24,Donald M. McRAE,YES,"Canadian, New Zealand",Michael C. PRYLES,YES,Australian,John R. CROOK,YES,U.S.,"Mannheimer Swartling, Stockholm, Sweden Shearman & Sterling, Paris, France","Lalive, Geneva, Switzerland Leaua & Asociaţii, Bucharest, Romania",,
UNC074,Aguas del Tunari S.A. v. Republic of Bolivia,ARB/02/3,Water and sewer services concession,2002-02-25,David D. CARON,YES,U.S.,Henri C. ÁLVAREZ,YES,Canadian,José Luis ALBERRO-SEMERENA,YES,Mexican,"President, Aguas del Tunari S.A., Washington, D.C., U.S.A. Servicios Legales, La Paz, Bolivia Herbert Smith, London, U.K.","Minister of Services and Public Works, La Paz, Bolivia Crowell & Moring, Washington, D.C., U.S.A. Criales, Urcullo, Freire & Villegas, La Paz, Bolivia","Settlement agreed by the parties and proceeding discontinued at the request of the Respondent (Order taking note of the discontinuance pursuant to ICSID Arbitration Rule 44 issued by the Tribunal on March 28, 2006).",2006
UNC017,Metalclad Corporation v. United Mexican States,ARB(AF)/97/1,Waste disposal enterprise,1997-01-13,Elihu LAUTERPACHT,YES,British,Benjamin R. CIVILETTI,YES,U.S.,José Luis SIQUEIROS,YES,Mexican,"Law Offices of Clyde C. Pearce, Salinas, CA, U.S.A.","Consultor Jurídico, Subsecretaría de Negociaciones Comerciales Internacionales, Dirección General de Consultoría Jurídica de Negociaciones, Secretaría de Comercio y Fomento Industrial, Mexico City, Mexico","Award rendered on August 30, 2000.",2000
UNC263,"Piero Foresti, Laura de Carli and others v. Republic of South Africa",ARB(AF)/07/1,Quarrying and trading enterprise,2007-01-08,Vaughan LOWE,YES,British,Charles N. BROWER,YES,U.S.,Joseph M. MATTHEWS,YES,U.S.,"Webber Wentzel, Johannesburg, South Africa Toby Landau, London, U.K. Elihu Lauterpacht, London, U.K","State Attorney of the Republic of South Africa, Pretoria, South Africa Freshfields Bruckhaus Deringer, Paris, France Gerrit L. Grobler, Pretoria, South Africa","The Tribunal renders its award on August 4, 2010. Attached to the award is a concurring opinion by one of the arbitrators.",2010
UNC224,Phoenix Action Ltd v. Czech Republic,ARB/06/5,Metal industry project,2006-03-23,Brigitte STERN,YES,French,Andreas BUCHER,YES,Swiss,Juan FERNÁNDEZ-ARMESTO,YES,Spanish,"Covington & Burling, Washington D.C., U.S.A General Director of BENet Praha spol. s r.o., Prague, Czech Republic","Squire Sanders & Dempsey, Cleveland, OH, U.S.A., and Prague, Czech Republic","Award rendered on April 15, 2009.",2009
UNC256,Tza Yap Shum v. Republic of Peru,ARB/07/6,Fish flour production enterprise,2007-02-12,Judd L. KESSLER,YES,U.S.,Hernando OTERO,YES,Colombian,Juan FERNÁNDEZ-ARMESTO,YES,Spanish,,,"Award rendered on July 7, 2011.",2011
UNC202,Parkerings-Compagniet AS v. Republic of Lithuania,ARB/05/8,Public parking concession,2005-05-16,Laurent LÉVY,YES,"Swiss, Brazilian",Marc LALONDE,YES,Canadian,Julian D.M. LEW,YES,British,"Debevoise & Plimpton, New York, NY, U.S.A., and Paris, France Norcous & Partners, Vilnius, Lithuania Rochier Holmberg, Attorneys, Helsinki, Finland","Ministry of Justice, Vilnius, Lithuania Freshfields Bruckhaus Deringer, New York, NY, U.S.A., and Paris, France Law Office Adamonis, Beržanskienè and partners Sorainen Law Offices, Vilnius, Lithuania","Award rendered on September 11, 2007.",2007
UNC056,Generation Ukraine Inc. v. Ukraine,ARB/00/9,Construction of an office building,2000-10-20,Jan PAULSSON,YES,French,Eugen SALPIUS,YES,Austrian,Jürgen VOSS,YES,German,"Generation Ukraine Inc., Chairman of the Board, New York, NY, U.S.A. McKeever Rowan Solicitors, Dublin, Ireland","Chief of Main Legal Department, Ministry of Economy and on Issues of European Integration of Ukraine, Kiev, Ukraine Head of Main Department for Foreign Economic Relations and Head of Legal Department, Kiev State City Administration, Kiev, Ukraine Grischenko and Partners, Kiev, Ukraine","Award rendered on September 16, 2003.",2003
UNC028,Joseph C. Lemire v. Ukraine,ARB(AF)/98/1,Radio broadcasting enterprise,1998-01-16,Elihu LAUTERPACHT,YES,British,Jan PAULSSON,YES,French,Jürgen VOSS,YES,German,"Coudert Brothers, Washington, D.C., U.S.A. Kevin P. Block, Napa, CA, U.S.A.","Grischenko & Partners, Kiev, Ukraine Deputy Chairman, National Agency of Ukraine for Development and European Integration, Kiev, Ukraine","Settlement agreed by the parties and settlement recorded at their request in the form of an award (Award embodying the parties' settlement agreement rendered on September 18, 2000, pursuant to ICSID Arbitration Rule 43(2)).",2000
UNC245,Joseph C. Lemire v. Ukraine,ARB/06/18,Radio broadcasting enterprise,2006-12-08,Juan FERNÁNDEZ-ARMESTO,YES,Spanish,Jan PAULSSON,YES,French,Jürgen VOSS,YES,German,"Ministry of Justice of Ukraine White & Case, Paris, France Magisters, Kyiv, Ukraine","Language(s) of Proceeding;English;Status of Proceeding;Concluded;Outcome of Proceeding;Award rendered on March 28, 2011, attached to the Award is a Dissenting Opinion by one of the arbitrators.;(b) Annulment Proceeding;Applicant(s)/Requesting Party(ies);Respondent(s);Respondent(s) on Annulment;Date Registered;July 27, 2011 (Respondent(s));Date of Constitution of ad hoc Committee;October 7, 2011;Composition of ad hoc Committee (Appointed by the Chairman of the Administrative Council);President;Claus VON WOBESER (Mexican);Members;Azzedine KETTANI (Moroccan) Eduardo ZULETA (Colombian);Initial Composition of ad hoc Committee;President;Members;Reconstituted;Party Representatives;Claimant(s): Ministry of Justice of Ukraine White & Case, Paris, France Magisters, Kyiv, Ukraine","Award rendered on March 28, 2011, attached to the Award is a Dissenting Opinion by one of the arbitrators.",2011
UNC291,Millicom International Operations B.V. and Sentel GSM S.A. v. Republic of Senegal,ARB/08/20,Telecommunications enterprise,2008-12-31,Pierre TERCIER,YES,Swiss,Ronny ABRAHAM,YES,French,Kaj HOBÉR,YES,Swedish,"Allen & Overy, London, U.K.","Carbonnier Lamaze Rasle & Associés, Paris, France King & Spalding, Paris, France","Settlement agreed by the parties and settlement recorded at their request in the form of an award (Award embodying the parties' settlement agreement rendered on November 27, 2012, pursuant to ICSID Arbitration Rule 43(2)).",2012
UNC527,ASA International S.p.A. v. Arab Republic of Egypt,ARB/13/23,Waste management services,2013-09-13,Rodrigo OREAMUNO,YES,Costa Rican,Albert Jan VAN DEN BERG,YES,Dutch,Kamal HOSSAIN,YES,Bangladeshi,"McDermott Will & Emery, Rome, Italy","Egyptian State Lawsuits Authority, Cairo, Egypt",,
UNC297,Impregilo S.p.A. v. Argentine Republic,ARB/08/14,Highway construction concession,2008-10-15,Hans DANELIUS,YES,Swedish,Charles N. BROWER,YES,U.S.,Kamal HOSSAIN,YES,Bangladeshi,"King & Spalding, Houston, TX, U.S.A.","Procurador del Tesoro de la Nación, Buenos Aires, Argentina","The Tribunal issues an order for the;discontinuance of the proceeding pursuant ICSID Arbitration Rule 43(1) on October 27, 2010.",2010
,Vacuum Salt Products Ltd. v. Republic of Ghana,ARB/92/1,Salt mining operation,1992-06-11,Robert Y. JENNINGS,YES,British,Charles N. BROWER,YES,U.S.,Kamal HOSSAIN,YES,Bangladeshi,"Thacher Proffitt & Wood, New York City, NY, U.S.A.","Attorney-General of Ghana, Accra, Ghana","Award declining jurisdiction over the dispute rendered on February 16, 1994.",1994
UNC298,Caratube International Oil Company LLP v. Republic of Kazakhstan,ARB/08/12,Oil exploration and production contract,2008-08-26,Karl-Heinz BÖCKSTIEGEL,YES,German,Gavan GRIFFITH,YES,Australian,Kamal HOSSAIN,YES,Bangladeshi,"Derains & Gharavi, Paris, France","Language(s) of Proceeding;English;Status of Proceeding;Concluded;Outcome of Proceeding;Award rendered on June 5, 2012.;(b) Annulment Proceeding;Applicant(s)/Requesting Party(ies);Claimant(s);Respondent(s) on Annulment;Date Registered;October 5, 2012 (Claimant(s));Date of Constitution of ad hoc Committee;November 12, 2012;Composition of ad hoc Committee (Appointed by the Chairman of the Administrative Council);President;Juan FERNÁNDEZ-ARMESTO (Spanish);Members;Cecil W.M. ABRAHAM (Malaysian) Hans DANELIUS (Swedish);Initial Composition of ad hoc Committee;President;Members;Reconstituted;Party Representatives;Claimant(s): Derains & Gharavi, Paris, France","Award rendered on June 5, 2012.",2012
UNC336,"Teinver S.A., Transportes de Cercanías S.A. and Autobuses Urbanos del Sur S.A. v. Argentine Republic",ARB/09/1,Air transportation services,2009-01-30,Thomas BUERGENTHAL,YES,U.S.,Henri C. ÁLVAREZ,YES,Canadian,Kamal HOSSAIN,YES,Bangladeshi,"King & Spalding, Houston, TX and Washington, D.C., U.S.A.","Procuradora del Tesoro de la Nación, Buenos Aires, Argentina",,
,Tullow Uganda Operations Pty Ltd and Tullow Uganda Limited v. Republic of Uganda,ARB/13/25,"Petroleum exploration, development, and production activities",2013-09-26,Jean Engelmayer KALICKI,YES,U.S.,William W. PARK,YES,"Swiss, U.S.",Kamal HOSSAIN,YES,Bangladeshi,"Freshfields Bruckhaus Deringer, London, U.K. Three Crowns, London, U.K. Kampala Associated Advocates, Kampala, Uganda","Curtis, Mallet-Prevost, Colt & Mosle, London, U.K. Ministry of Justice and Constitutional Affairs, Kampala, Uganda","Order taking note of the discontinuance of the proceeding pursuant to ICSID Arbitration Rule 43(1) issued on July 15, 2015.",2015
UNC099,Bayindir Insaat Turizm Ticaret Ve Sanayi A.S. v. Islamic Republic of Pakistan,ARB/03/29,Highway construction contract,2003-12-01,Gabrielle KAUFMANN-KOHLER,YES,Swiss,Franklin BERMAN,YES,British,Karl-Heinz BÖCKSTIEGEL,YES,German,"Samdani & Qureshi, Islamabad, Pakistan Sidley Austin, Washington, D.C., U.S.A. Stephen M. Schwebel, Washington, D.C., U.S.A.","Attorney General for Pakistan, Islamabad, Pakistan Samuel Wordsworth, London, U.K. Eversheds, Paris, France","Award rendered on August 27, 2009.",2009
,Ghaith R. Pharaon v. Republic of Tunisia,ARB/86/1,Tourism and holiday resort projects,1986-09-24,Claude REYMOND,YES,Swiss,Giorgio BERNINI,YES,Italian,Karl-Heinz BÖCKSTIEGEL,YES,German,"Coudert Brothers, Paris, France","Chef du Contentieux de l'Etat, Ministere du Plan et des Finances, Tunis, Tunisia","Settlement agreed by the parties and proceeding discontinued at their request (Order taking note of the discontinuance issued by the Tribunal on November 21, 1988 pursuant to Arbitration Rule 43 (1)).",1988
UNC002,"American Manufacturing & Trading, Inc. v. Democratic Republic of the Congo",ARB/93/1,Manufacturing and trading enterprise,1993-02-02,Sompong SUCHARITKUL,YES,Thai,Heribert GOLSONG,YES,German,Kéba MBAYE,YES,Senegalese,"Dinur & Associates, Atlanta, GA, U.S.A.",Manzila Lundum Sal Ramazani Baya,"Award rendered on February 21, 1997.",1997
UNC023,Compagnie Minière Internationale Or S.A. v. Republic of Peru,ARB/98/6,Gold mining project,1998-10-28,Ian BROWNLIE,YES,British,Henri C. ÁLVAREZ,YES,Canadian,Keith HIGHET,YES,U.S.,"Freshfields Bruckhaus Deringer, Paris, France","Ministerio de Relaciones Exteriores, Lima, Peru Baker and Hostetler, Washington, D.C., U.S.A.","Settlement agreed by the parties and proceeding discontinued at their request (Order taking note of the discontinuance of the proceeding issued by the Secretary-General on February 23, 2001, pursuant to Arbitration Rule 43(1)).",2001
UNC031,Alimenta S.A. v. Republic of The Gambia,ARB/99/5,Groundnut enterprise,1999-07-12,Charles N. BROWER,YES,U.S.,Samuel K.B. ASANTE,YES,Ghanaian,Kenneth S. ROKISON,YES,British,"Lalive & Partners, Geneva, Switzerland","Attorney General & Secretary of State for Justice, Banjul, The Gambia Solicitor General and Legal Secretary, Department of State for Justice, Banjul, The Gambia","Settlement agreed by the parties and proceeding discontinued at their request (Order taking note of discontinuance of the proceeding issued by the Arbitral Tribunal on May 3, 2001, pursuant to Arbitration Rule 43(1)).",2001
UNC383,AES Corporation and Tau Power B.V. v. Republic of Kazakhstan,ARB/10/16,Power facilities and trading companies,2010-07-20,Pierre TERCIER,YES,Swiss,Vaughan LOWE,YES,British,Klaus SACHS,YES,German,"Allen & Overy, London, U.K.","Reed Smith, London, U.K. Ministry of Justice of Kazakhstan, Prime Minister of Kazakhstan and Minister of Finance of Kazakhstan, Astana, Kazakhstan Joe Smouha, London, U.K.","Award rendered on November 1, 2013.",2013
UNC146,OKO Pankki Oyj and others v. Republic of Estonia,ARB/04/6,Debt instruments,2004-02-20,Otto L.O. DE WITT WIJNEN,YES,Dutch,V.V. VEEDER,YES,British,L. Yves FORTIER,YES,Canadian,"Hannes Snellman Attorneys at Law, Helsinki, Finland","Freshfields Bruckhaus Deringer, Amsterdam, Netherlands, and Paris, France Law Office Aivar Pilv, Tallinn, Estonia","Award rendered on November 19, 2007.",2007
UNC455,Muhammet Çap & Sehil Inşaat Endustri ve Ticaret Ltd. Sti. v. Turkmenistan,ARB/12/6,Construction projects,2012-03-26,Julian D.M. LEW,YES,British,Bernard HANOTIAU,YES,Belgian,Laurence BOISSON DE CHAZOURNES,YES,"Swiss, French","Derains & Gharavi, Paris, France, and Washington D.C., U.S.A. Akinci Law Office, Istanbul, Turkey","Curtis, Mallet-Prevost, Colt & Mosle, Washington, D.C. and New York, NY, U.S.A., and Istanbul, Turkey Yurttutan Gürel Yörüker Law Firm, Istanbul, Turkey",,
UNC418,Garanti Koza LLP v. Turkmenistan,ARB/11/20,Construction project,2011-07-20,John M. TOWNSEND,YES,U.S.,George Constantine LAMBROU,YES,Greek,Laurence BOISSON DE CHAZOURNES,YES,"Swiss, French","Gur Law Firm, Istanbul,Turkey King & Spalding, Singapore","Curtis, Mallet-Prevost, Colt & Mosle, Istanbul, Turkey, Paris, France, and Washington, D.C., U.S.A. Yurttutan Gürel Yörüker, Istanbul, Turkey",,
UNC406,Crystallex International Corporation v. Bolivarian Republic of Venezuela,ARB(AF)/11/2,Mining company,2011-03-09,Laurent LÉVY,YES,"Swiss, Brazilian",John Y. GOTANDA,YES,U.S.,Laurence BOISSON DE CHAZOURNES,YES,"Swiss, French","Freshfields Bruckhaus Deringer US, Washington, D.C., U.S.A. Travieso Evans Arria Rengel & Paz, Caracas, Venezuela Wallis & Guerrero, Caracas Venezuela","Procuradur&iacutea General de la Rep&uacuteblica, Caracas, Venezuela Foley Hoag, Washington, D.C., U.S.A.",,
UNC568,NextEra Energy Global Holdings B.V. and NextEra Energy Spain Holdings B.V. v. Kingdom of Spain,ARB/14/11,Renewable energy generation enterprise,2014-05-23,Donald M. McRAE,YES,"Canadian, New Zealand",L. Yves FORTIER,YES,Canadian,Laurence BOISSON DE CHAZOURNES,YES,"Swiss, French","Skadden, Arps, Slate, Meagher & Flom, London, U.K.","Abogacía General del Estado, The Ministry of Justice of the Government of Spain, Madrid, Spain",,
UNC075,"Champion Trading Company and Ameritrade International, Inc. v. Arab Republic of Egypt",ARB/02/9,Cotton processing and trading enterprise,2002-08-08,Robert BRINER,YES,Swiss,L. Yves FORTIER,YES,Canadian,Laurent AYNÈS,YES,French,"Fasken Martineau DuMoulin, Montreal, Canada","Bredin Prat, Paris, France","Award rendered on October 27, 2006.",2006
UNC262,Saba Fakes v. Republic of Turkey,ARB/07/20,Mobile telecommunications services,2007-08-13,Emmanuel GAILLARD,YES,French,Hans VAN HOUTTE,YES,Belgian,Laurent LÉVY,YES,"Swiss, Brazilian","Houthoff Buruma, Rotterdam, Netherlands","Derains & Gharavi, Paris, France","Award rendered on July 14, 2010.",2010
,Société Civile Immobilière de Gaëta v. Republic of Guinea,ARB/12/36,Development and operation of commercial property,2012-11-28,Pierre TERCIER,YES,Swiss,Horacio A. GRIGERA NAÓN,YES,Argentine,Laurent LÉVY,YES,"Swiss, Brazilian","Derains & Gharavi, Paris, France SCP Akl & Akl, Beirut, Lebanon","Orrick Rambaud Martel, Paris, France Cabinet Mamadou S. Traore, Ouagadougou, Burkina Faso",,
UNC261,Europe Cement Investment and Trade S.A. v. Republic of Turkey,ARB(AF)/07/2,Electricity concessions,2007-03-06,Donald M. McRAE,YES,"Canadian, New Zealand",Julian D.M. LEW,YES,British,Laurent LÉVY,YES,"Swiss, Brazilian","Teissonnière Sardain Chevé, Paris, France","Freshfields Bruckhaus Deringer, New York, NY, U.S.A, and Paris, France Coşar Avukatlik Bürosu, Istanbul, Turkey","Award rendered on August 13, 2009.",2009
UNC094,IBM World Trade Corp. v. Republic of Ecuador,ARB/02/10,Informatic services contract,2002-09-06,Rodrigo JIJÓN LETORT,YES,Ecuadoran,Alejandro PONCE MARTÍNEZ,YES,Ecuadoran,León ROLDÓS AGUILERA,YES,Ecuadoran,"Agent, IBM World Trade Corporation, Quito, Ecuador","Procurador General del Estado, Quito, Ecuador","Settlement agreed by the parties and settlement recorded at their request in the form of an award (Award embodying the parties' settlement agreement rendered on July 22, 2004, pursuant to ICSID Arbitration Rule 43(2)).",2004
UNC579,"Albaniabeg Ambient Sh.p.k, M. Angelo Novelli and Costruzioni S.r.l. v. Republic of Albania",ARB/14/26,Waste management and renewable energy production project,2014-11-07,David D. CARON,YES,U.S.,John M. TOWNSEND,YES,U.S.,Leonard HOFFMANN,YES,British,"Quinn Emanuel Urquhart & Sullivan, Paris, France, and New York, NY, U.S.A. Scemla Loizon Veverka & de Fontmichel, Paris, France Andrea Di Porto, Rome, Italy","State Advocate General of the Republic of Albania, Tirana, Albania Wragge Lawrence Graham & Co, London, U.K.",,
UNC465,Tethyan Copper Company Pty Limited v. Islamic Republic of Pakistan,ARB/12/1,Mineral exploration operations,2012-01-12,Klaus SACHS,YES,German,Stanimir A. ALEXANDROV,YES,Bulgarian,Leonard HOFFMANN,YES,British,"Debevoise & Plimpton, New York, NY, U.S.A. and London, U.K. Fazle Ghani Advocates, Karachi, Pakistan","Allen & Overy, London, U.K. ABS & Co., Islamabad, Pakistan",,
,African Petroleum Gambia Limited (Block A1) v. Republic of The Gambia,ARB/14/6,"Petroleum exploration, development, and production activities",2014-03-12,Jan PAULSSON,YES,"Bahraini, Swedish, French",Alexis MOURRE,YES,French,Loretta MALINTOPPI,YES,Italian,"Clyde & Co., London, U.K. Klaus Reichert, London, U.K.","Mayer Brown, Paris, France Farage Andrews Law Practice, Fajara Kanifing Municipality, Gambia","Order taking note of the discontinuance of the proceeding pursuant to ICSID Arbitration Rule 43(1) issued on January 27, 2015.",2015
,African Petroleum Gambia Limited (Block A4) v. Republic of The Gambia,ARB/14/7,"Petroleum exploration, development, and production activities",2014-03-12,Jan PAULSSON,YES,"Bahraini, Swedish, French",Alexis MOURRE,YES,French,Loretta MALINTOPPI,YES,Italian,"Clyde & Co., London, U.K. Klaus Reichert, London, U.K.","Mayer Brown, Paris, France Farage Andrews Law Practice, Fajara Kanifing Municipality, Gambia","Order taking note of the discontinuance of the proceeding pursuant to ICSID Arbitration Rule 43(1) issued on January 27, 2015.",2015
UNC427,Longreef Investments A.V.V. v. Bolivarian Republic of Venezuela,ARB/11/5,Coffee production facilities,2011-02-23,David A.O. EDWARD,YES,British,Enrique GÓMEZ-PINZÓN,YES,Colombian,Loretta MALINTOPPI,YES,Italian,"Baker & McKenzie, New York, NY, U.S.A.","Procuradur&iacutea General de la Rep&uacuteblica, Caracas, Venezuela Hogan Lovells, Caracas, Venezuela, Madrid, Spain and Paris, France",,
UNC470,Blue Bank International & Trust (Barbados) Ltd. v. Bolivarian Republic of Venezuela,ARB/12/20,Tourism and hospitality facilities,2012-08-07,Christer SÖDERLUND,YES,Swedish,George BERMANN,YES,U.S.,Loretta MALINTOPPI,YES,Italian,"DLA Piper, Miami, FL, U.S.A.","Procuradur&iacutea General de la Rep&uacuteblica, Caracas, Venezuela Guglielmino & Asociados, Buenos Aires, Argentina",,
UNC155,Total S.A. v. Argentine Republic,ARB/04/1,Gas production and distribution/power generation project,2004-01-22,Giorgio SACERDOTI,YES,Italian,Henri C. ÁLVAREZ,YES,Canadian,Luis HERRERA MARCANO,YES,Venezuelan,"Freshfields Bruckhaus Deringer, Paris, France and New York, NY, U.S.A. Abeledo Gottheil Abogados SC, Buenos Aires, Argentina","Procuradora del Tesoro de la Nación, Buenos Aires, Argentina","Award rendered on November 27, 2013.",2013
UNC014,"Lanco International, Inc. v. Argentine Republic",ARB/97/6,Port terminal concession agreement,1997-10-14,Bernardo M. CREMADES,YES,Spanish,Guillermo AGUILAR-ALVAREZ,YES,Mexican,Luiz Olavo BAPTISTA,YES,Brazilian,"Powell, Goldstein, Frazer & Murphy, Washington, D.C., U.S.A.","Secretariat of International Economic Relations of the Ministry of Foreign Affairs, International Trade and Worship, Buenos Aires, Argentina","Proceeding discontinued at the request of the Claimant (Order taking note of the discontinuance issued by the Tribunal on October 17, 2000 pursuant to Arbitration Rule 44).",2000
UNC593,Elektrogospodarstvo Slovenije - razvoj in inzeniring d.o.o. v. Bosnia and Herzegovina,ARB/14/13,Thermal power plant project,2014-06-16,Christopher GREENWOOD,YES,British,Jan PAULSSON,YES,"Bahraini, Swedish, French",Maja STANIVUKOVIĆ,YES,Serbian,"Rojs, Pelijhan, Prelesnik & partners, Ljublana, Slovenia","Presidency of Bosnia and Herzegovina, Bosnia and Herzegovina",,
UNC582,Michael Dagher v. Republic of the Sudan,ARB/14/2,Wireless internet service enterprise,2014-02-21,Yas BANIFATEMI,YES,"Iranian, French",William W. PARK,YES,"Swiss, U.S.",Makhdoom Ali KHAN,YES,Pakistani,"Winston & Strawn, Geneva, Switzerland","Derains & Gharavi, Paris, France Matrix Chambers, London, U.K.",,
,Newmont USA Limited and Newmont (Uzbekistan) Limited v. Republic of Uzbekistan,ARB/06/20,Gold extraction enterprise,2006-12-12,V.V. VEEDER,YES,British,Christopher GREENWOOD,YES,British,Marc LALONDE,YES,Canadian,"Covington & Burling, Washington, D.C., U.S.A.","Debevoise & Plimpton, New York, NY, U.S.A, and Paris, France","Settlement agreed by the parties and proceeding discontinued at their request (Order taking note of the discontinuance issued by the Tribunal on July 25, 2007 pursuant to Arbitration Rule 43(1)).",2007
UNC228,The Rompetrol Group N.V. v. Romania,ARB/06/3,Oil refinery,2006-02-14,Franklin BERMAN,YES,British,Donald DONOVAN,YES,U.S.,Marc LALONDE,YES,Canadian,"Dentons, Paris, France","Lalive, Geneva, Switzerland Tanasescu & Asociatii, Bucharest, Romania Leaua & Asociatii, Bucharest, Romania","Award rendered on May 6, 2013.",2013
