ID,Case Title,Case Number,InvestmentType,Date Registered,Arbitrator1,Arbitrator1President,President Nationality,Arbitrator2,Arbitrator2Claimant,Arbitrators 1 Nationality,Arbitrator3,Arbitrator3Respondent,Arbitrator 2 Nationality,Claimant Representative,Respondent Representative,Outcome Of Proceeding,ResolutionYear
UNC548,Joseph Houben v. Republic of Burundi,ARB/13/7,Real estate project,2013-05-20,Gilbert GUILLAUME,YES,French,Yas BANIFATEMI,YES,"Iranian, French",Brigitte STERN,YES,French,"Cabinet de Ma&icirctre Sylvestre Banzubaze, Bujumbura, Burundi Cabinet de Ma&icirctre Michel Lion, Brussels, Belgium VVGB ALTRA Avocats, Brussels, Belgium","Minist&egravere de la Justice et Garde des Sceaux, Bujumbura, Burundi Liedekerke, Wolters, Waelbroeck, Kirkpatrick, Brussels, Belgium Cabinet de Ma&icirctre Sixte Sizimwe Kazirukanyo, Bujumbura, Burundi",,
,Standard Chartered Bank (Hong Kong) Limited v. Tanzania Electric Supply Company Limited,ARB/10/20,Power purchase agreement,2010-10-01,Donald M. McRAE,YES,"Canadian, New Zealand",Zachary DOUGLAS,YES,Australian,Brigitte STERN,YES,French,"Herbert Smith Freehills, London, U.K.","Crax Law Partners, Dar es Salaam, Tanzania Rweyongeza and Company Advocates, Dar es Salaam, Tanzania Kellerhals Attorneys at Law, Zurich, Switzerland",,
UNC485,Rusoro Mining Ltd. v. Bolivarian Republic of Venezuela,ARB(AF)/12/5,Gold exploration and exploitation operations,2012-08-01,Juan FERNÁNDEZ-ARMESTO,YES,Spanish,Francisco ORREGO VICUÑA,YES,Chilean,Bruno SIMMA,YES,"German, Austrian","Freshfields Bruckhaus Deringer, Washington, D.C., U.S.A. Figueiras & Fishbach, Caracas, Venezuela Mezgravis & Asociados, Caracas, Venezuela","Procuradur&iacutea General de la Rep&uacuteblica, Caracas, Venezuela Foley Hoag, Washington D.C., U.S.A.",,
UNC471,Ampal-American Israel Corporation and others v. Arab Republic of Egypt,ARB/12/11,Natural gas export,2012-05-23,L. Yves FORTIER,YES,Canadian,Francisco ORREGO VICUÑA,YES,Chilean,Campbell Alan McLACHLAN,YES,New Zealand,"Freshfields Bruckhaus Deringer, Paris, France","Egyptian State Lawsuits Authority, Cairo, Egypt Shearman & Sterling, Paris, France",,
,"Niko Resources (Bangladesh) Ltd. v. Bangladesh Petroleum Exploration and Production Company Limited (""Bapex"") and Bangladesh Oil Gas and Mineral Corporation (""Petrobangla"")",ARB/10/18,Gas purchase and sale agreement,2010-07-28,Michael E. SCHNEIDER,YES,German,Jan PAULSSON,YES,"Bahraini, Swedish, French",Campbell Alan McLACHLAN,YES,New Zealand,"Denton Europe, Paris, France Dentons Canada, Calgary, Canada Rokanuddin Mahmud, Dhaka, Bangladesh","Secretary, Petrobangla, Dhaka, Bangladesh Managing Director, Bapex, Dhaka, Bangladesh Foley Hoag, Washington, D.C., U.S.A.",,
UNC537,Eiser Infrastructure Limited and Energía Solar Luxembourg S.à r.l. v. Kingdom of Spain,ARB/13/36,Renewable energy generation enterprise,2013-12-23,John R. CROOK,YES,U.S.,Stanimir A. ALEXANDROV,YES,Bulgarian,Campbell Alan McLACHLAN,YES,New Zealand,"Allen & Overy, London, U.K.","Abogacía General del Estado, The Ministry of Justice of the Government of Spain, Madrid, Spain",,
,"Lighthouse Corporation Pty Ltd and Lighthouse Corporation Ltd, IBC v. Democratic Republic of Timor-Leste",ARB/15/2,Fuel supply agreement,2015-01-14,Gabrielle KAUFMANN-KOHLER,YES,Swiss,Stephen JAGUSCH,YES,New Zealand,Campbell Alan McLACHLAN,YES,New Zealand,"Johnson Winter & Slattery, Sydney, Australia","DLA Piper, Brisbane, Australia",,
UNC045,"Técnicas Medioambientales Tecmed, S.A. v. United Mexican States",ARB(AF)/00/2,Waste disposal enterprise,2000-08-28,Horacio A. GRIGERA NAÓN,YES,Argentine,José Carlos FERNÁNDEZ ROZAS,YES,Spanish,Carlos BERNAL VEREA,YES,Mexican,"Juan Carlos Calvo Corbella, Técnicas Medioambientales, TECMED, S.A., Madrid, Spain Jones, Day, Reavis & Pogue Abogados, Madrid, Spain","Dirección General de Consultoría, Jurídica de Negociaciones Comerciales, Subsecretaría de Negociaciones Comerciales Internacionales, Secretaría de Economía, Mexico City, Mexico","Award rendered on May 29, 2003.",2003
,Astaldi S.p.A. & Columbus Latinoamericana de Construcciones S.A. v. Republic of Honduras,ARB/99/8,Highway rehabilitation contract,1999-12-29,Roberto ANDINO,YES,Honduran,German FLORES,YES,Honduran,Carlos Roberto CASTILLO,YES,Honduran,"Representing Astaldi S.p.A.: Andrea Gentili, Tegucigalpa, Honduras Representing Columbus Latinamericana de Construcciones: Andrea Gentili, Antonio Oselini, Tegucigalpa, Honduras Representing both: Mario Ivan Casco, Tegucigalpa, Honduras","Procurador General de la República, Tegucigalpa, Honduras","Award rendered on October 19, 2000.",2000
UNC053,ADF Group Inc. v. United States of America,ARB(AF)/00/1,Highway construction project,2000-08-25,Florentino P. FELICIANO,YES,Philippine,Armand DE MESTRAL,YES,"Swiss, Canadian",Carolyn B. LAMM,YES,U.S.,"Fasken Martineau Du Moulin, Montreal, Canada","United States Department of State, Office of the Legal Adviser, Washington, D.C., U.S.A.","Award rendered on January 9, 2003.",2003
,"Banro American Resources, Inc. and Société Aurifère du Kivu et du Maniema S.A.R.L. v. Democratic Republic of the Congo",ARB/98/7,Gold mining concessions,1998-10-28,Prosper WEIL,YES,French,Alioune DIAGNE,YES,Senegalese,Carveth Harcourt GEACH,YES,South African,"Akin, Gump, Strauss, Hauer & Feld, Washington, D.C., U.S.A.","Ministre de la Justice et Garde des Sceaux, Ministry of Justice, Kinshasa-Gombe, Democratic Republic of Congo Minister-Counselor, Chargé d’Affaires, Embassy of the Democratic Republic of Congo, Washington, D.C., U.S.A.","Award rendered on September 1, 2000, attached to the award is a dissenting opinion by arbitrator Carveth Harcourt Geach.",2000
UNC112,Miminco LLC and others v. Democratic Republic of the Congo,ARB/03/14,Diamond mining concessions,2003-06-09,Ahmed Sadek EL-KOSHERI,YES,Egyptian,Marc LALONDE,YES,Canadian,Catherine KESSEDJIAN,YES,French,"Chairman, Miminco, Newton, MA, U.S.A. Managing Director, Miminco, Silver Spring, MD, U.S.A.","Ministre de la Justice et Garde des Sceaux, Kinshasa, Democratic Republic of the Congo Cabinet Tshibangu & Associés, Kinshasa, Democratic Republic of Congo","Settlement agreed by the parties and settlement recorded at their request in the form of an award (Award embodying the parties' settlement agreement rendered on November 19, 2007, pursuant to ICSID Arbitration Rule 43(2)).",2007
UNC456,Saint-Gobain Performance Plastics Europe v. Bolivarian Republic of Venezuela,ARB/12/13,Proppant production,2012-06-15,Klaus SACHS,YES,German,Gabriel BOTTINI,YES,Argentine,Charles N. BROWER,YES,U.S.,"Hughes Hubbard & Reed, New York, NY, U.S.A. and Washington, D.C., U.S.A. Freshfields Bruckhaus Deringer, New York, NY, U.S.A.","Procuraduría General de la República, Caracas, Venezuela Curtis, Mallet-Prevost, Colt & Mosle, New York, NY, U.S.A. and Mexico City, Mexico",,
UNC327,"Holcim Limited, Holderfin B.V. and Caricement B.V. v. Bolivarian Republic of Venezuela",ARB/09/3,Cement production enterprise,2009-04-10,Juan FERNÁNDEZ-ARMESTO,YES,Spanish,Georges ABI-SAAB,YES,Egyptian,Charles N. BROWER,YES,U.S.,"Debevoise & Plimpton, New York, NY, U.S.A.","Procuradur&iacutea General de la Rep&uacuteblica, Caracas, Venezuela Curtis, Mallet-Prevost, Colt & Mosle, New York, NY, U.S.A. and Mexico City, Mexico",,
UNC469,Vattenfall AB and others v. Federal Republic of Germany,ARB/12/12,Nuclear power plant,2012-05-31,Albert Jan VAN DEN BERG,YES,Dutch,Vaughan LOWE,YES,British,Charles N. BROWER,YES,U.S.,"Mannheimer Swartling Advokatbyrå AB, Stockholm, Sweden Luther Rechtsanwaltsgesellschaft mbH, Hamburg, Germany","Ministerium für Wirtschaft und Energie, Berlin, Germany McDermott Will & Emery Rechtsanwälte Steuerberater, Frankfurt, Germany",,
UNC175,SAUR International v. Argentine Republic,ARB/04/4,Water and sewer services concession agreement,2004-01-27,Juan FERNÁNDEZ-ARMESTO,YES,Spanish,Bernard HANOTIAU,YES,Belgian,Christian TOMUSCHAT,YES,German,"Shearman & Sterling, Paris, France Quinn Emanuel Urquhart & Sullivan, Paris, France Latham & Watkins, Paris, France","Procuradora del Tesoro de la Naci&oacuten, Buenos Aires, Argentina","Award rendered on May 22, 2014.",2014
UNC176,CIT Group Inc. v. Argentine Republic,ARB/04/9,Leasing enterprise,2004-02-27,Pierre-Marie DUPUY,YES,French,Claus VON WOBESER,YES,Mexican,Christian TOMUSCHAT,YES,German,"Hunton & Williams, Washington, D.C., U.S.A.","Procurador del Tesoro de la Nación, Buenos Aires, Argentina","The Tribunal issues an order taking note of the discontinuance of the proceeding pursuant to ICSID Arbitration Rule 44 on May 12, 2009.",2009
UNC227,"Azpetrol International Holdings B.V., Azpetrol Group B.V. and Azpetrol Oil Services Group B.V. v. Republic of Azerbaijan",ARB/06/15,"Oil and gas distribution, trade, storage and transportation enterprise",2006-08-30,Florentino P. FELICIANO,YES,Philippine,Charles N. BROWER,YES,U.S.,Christopher GREENWOOD,YES,British,"McDermott Will & Emery, London, U.K. Camilla Bingham, London, U.K. Peter Leaver, London, U.K.","Allen & Overy, London, U.K. Graham Dunning, London, U.K.","Award rendered on September 8, 2009.",2009
,Robert Azinian and others v. United Mexican States,ARB(AF)/97/2,Waste disposal enterprise,1997-03-24,Jan PAULSSON,YES,French,Benjamin R. CIVILETTI,YES,U.S.,Claus VON WOBESER,YES,Mexican,"Law Offices of David J. St. Louis, Fresno, CA, U.S.A.","Subsecretaría de Negociaciones Comerciales Internacionales, Dirección General de Consultoría Jurídica de Negociaciones, Secretaría de Comercio y Fomento Industrial, Mexico City, Mexico","Award rendered on November 1, 1999.",1999
UNC134,Inceysa Vallisoletana S.L. v. Republic of El Salvador,ARB/03/26,Motor vehicle inspection facility,2003-10-10,Rodrigo OREAMUNO,YES,Costa Rican,Burton LANDY,YES,U.S.,Claus VON WOBESER,YES,Mexican,,,"Award rendered on August 2, 2006.",2006
UNC565,Edenred S.A. v. Hungary,ARB/13/21,Food voucher services,2013-09-09,Juan FERNÁNDEZ-ARMESTO,YES,Spanish,Francisco ORREGO VICUÑA,YES,Chilean,Claus VON WOBESER,YES,Mexican,"Hogan Lovells, Paris, France","Government of Hungary, Budapest, Hungary Baker & McKenzie, New York, NY, U.S.A. and Budapest, Hungary",,
UNC451,"Vincent J. Ryan, Schooner Capital LLC, and Atlantic Investment Partners LLC v. Republic of Poland",ARB(AF)/11/3,Vegetable oil production and processing enterprise,2011-04-26,Makhdoom Ali KHAN,YES,Pakistani,Francisco ORREGO VICUÑA,YES,Chilean,Claus VON WOBESER,YES,Mexican,"Kochanski Zieba Rapala & Partners, Warsaw, Poland","K&L Gates Jamka sp.k., Warsaw, Poland State Treasury Solicitors",,
UNC452,"DP World Callao S.R.L., P&O Dover (Holding) Limited, and The Peninsular and Oriental Steam Navigation Company v. Republic of Peru",ARB/11/21,Pier concession agreement,2011-07-22,V.V. VEEDER,YES,British,Francisco ORREGO VICUÑA,YES,Chilean,Claus VON WOBESER,YES,Mexican,"Cleary Gottlieb Steen & Hamilton, New York, NY, U.S.A., Paris, France and Rome, Italy","Ministerio de Economía y Finanzas, Lima, Peru White & Case, Washington, D.C., U.S.A. Estudio Echecopar, Lima, Peru",,
UNC453,Highbury International AVV and Ramstein Trading Inc. v. Bolivarian Republic of Venezuela,ARB/11/1,Mining concession,2011-01-05,Enrique BARROS BOURIE,YES,Chilean,Guido Santiago TAWIL,YES,Argentine,Claus VON WOBESER,YES,Mexican,"Mezgravis & Asoc., Caracas, Venezuela","Procuradur&iacutea General de la Rep&uacuteblica, Caracas, Venezuela Foley Hoag, Washington, D.C., U.S.A.","Award rendered on September 26, 2013",2013
,"Aguaytia Energy, LLC v. Republic of Peru",ARB/06/13,Electricity generation and transmission,2006-07-17,Robert BRINER,YES,Swiss,J. William ROWLEY,YES,"British, Canadian",Claus VON WOBESER,YES,Mexican,"Vinson & Elkins, London, U.K. and Houston, TX, U.S.A.","White & Case, Washington, D.C., U.S.A. Estudio Echecopar, Lima, Peru","Award rendered on December 11, 2008.",2008
UNC401,Metal-Tech Ltd. v. Republic of Uzbekistan,ARB/10/3,Molybdenum plant,2010-02-04,Gabrielle KAUFMANN-KOHLER,YES,Swiss,John M. TOWNSEND,YES,U.S.,Claus VON WOBESER,YES,Mexican,"Covington & Burling, Washington, D.C., U.S.A.","White & Case, Washington, D.C., U.S.A. Ministry of Justice of the Republic of Uzbekistan, Tashkent, Uzbekistan","Award rendered on October 4, 2013.",2013
UNC244,"Nations Energy, Inc. and others v. Republic of Panama",ARB/06/19,Electricity power generation project,2006-12-11,Alexis MOURRE,YES,French,José María CHILLÓN MEDINA,YES,Spanish,Claus VON WOBESER,YES,Mexican,"Carlton Fields, P.A., Orlando, FL, U.S.A. Law Offices of George Muñoz, Arlington, VA, U.S.A. Katz & López, Panama City, Panama","Procuraduría General de la Nación, Panama City, Panama Arnold & Porter, Washington, D.C., U.S.A.","Award rendered on November 24, 2010, attached to the award is a dissenting opinion by one of the arbitrators.",2010
,Oded Besserglik v. Republic of Mozambique,ARB(AF)/14/2,Joint fishing operation,2014-07-03,Makhdoom Ali KHAN,YES,Pakistani,L. Yves FORTIER,YES,Canadian,Claus VON WOBESER,YES,Mexican,"H.P. Jefferys SC, Durban, South Africa","Dorsey & Whitney, Costa Mesa, California, U.S.A. MACT, Maputo, Mozambique",,
UNC402,"TECO Guatemala Holdings, LLC v. Republic of Guatemala",ARB/10/23,Electricity distribution concession,2010-11-23,Alexis MOURRE,YES,French,William W. PARK,YES,"Swiss, U.S.",Claus VON WOBESER,YES,Mexican,"White & Case, Washington, D.C., U.S.A.","Viceministerio de Integraci&oacuten y Comercio Exterior, Ministerio de Econom&iacutea, Guatemala City, Guatemala Arenales & Skinner Kl&eacutee, Guatemala City, Guatemala Freshfields Bruckhaus Deringer, Washington, D.C., U.S.A.","Award rendered on December 19, 2013.",2013
,Apotex Inc. v. United States of America,UNCT/10/2,Pharmaceutical enterprise,,Toby LANDAU,YES,British,Fern M. SMITH,YES,U.S.,Clifford M. DAVIDSON,YES,U.S.,"Rakoczy Molino Mazzochi Siwik, Chicago, IL, U.S.A.","United States Department of State, Washington, D.C., U.S.A.","Award on Jurisdiction and Admissibility rendered on June 14, 2013.",2013
,Liberian Eastern Timber Corporation v. Republic of Liberia,ARB/83/2,Forestry concession,1983-06-21,Bernardo M. CREMADES,YES,Spanish,Jorge GONCALVES PEREIRA,YES,Portuguese,D.A. REDFERN,YES,British,,,"Award rendered on March 31, 1986.",1986
,Aktau Petrol Ticaret A.Ş. and Som Petrol Ticaret A.Ş. v. Republic of Kazakhstan,ARB/15/8,Oil transportation and transshipment,2015-03-06,Ian BINNIE,YES,Canadian,Bernard HANOTIAU,YES,Belgian,Daniel BETHLEHEM,YES,British,"Derains & Gharavi, Paris, France Akinci Law Office, Paris, France","Reed Smith, London, U.K. Christopher Harris, London, U.K. The Ministry of Justice of the Government of the Republic of Kazakhstan, Astana, Republic of Kazakhstan",,
UNC510,Le Chèque Déjeuner and C.D Holding Internationale v. Hungary,ARB/13/35,Social voucher services,2013-12-23,Karl-Heinz BÖCKSTIEGEL,YES,German,L. Yves FORTIER,YES,Canadian,Daniel BETHLEHEM,YES,British,"Herbert Smith Freehills, Paris, France","Horváth and Partners Law Firm DLA Piper, Budapest, Hungary DLA Piper, New York, NY, U.S.A. Sarhegyi & Partners Law Firm, Budapest, Hungary",,
UNC061,Azurix Corp. v. Argentine Republic,ARB/01/12,Water and sewer services concession agreement,2001-10-23,Andrés RIGO SUREDA,YES,Spanish,Marc LALONDE,YES,Canadian,Daniel H. MARTINS,YES,Uruguayan,,,"Award rendered on July 14, 2006.",2006
UNC341,MTN (Dubai) Limited and MTN Yemen for Mobile Telephones v. Republic of Yemen,ARB/09/7,Operation of a global system for mobile communications (GSM) network,2009-05-01,Marc LALONDE,YES,Canadian,Barton LEGUM,YES,U.S.,Daniel M. PRICE,YES,U.S.,"Freshfields Bruckhaus Deringer, London, U.K., and Dubai, United Arab Emirates","Burnet, Duckworth & Palmer, Calgary, Canada Luqman Legal, Sana'a, Yemen","Settlement agreed by the parties and settlement recorded at their request in the form of an award (Award embodying the parties' settlement agreement rendered on June 25, 2010, pursuant to ICSID Arbitration Rule 43(2)).",2010
UNC033,Marvin Roy Feldman Karpa v. United Mexican States,ARB(AF)/99/1,Foreign trade enterprise,1999-05-27,Konstantinos D. KERAMEUS,YES,Greek,Jorge COVARRUBIAS BRAVO,YES,Mexican,David A. GANTZ,YES,U.S.,"Marvin Roy Feldman Karpa, CEMSA, Mexico City, Mexico King of Feldman Law Offices, Washington, D.C., U.S.A. Law Firm of Miller, Cassidy, Larroca & Lewin, Washington, D.C., U.S.A.","Subsecretaría de Negociaciones Comerciales Internacionales, DirecciÃ³n General de ConsultorÃ­a JurÃ­dica de Negociaciones, Ministry of Economy, Mexico City, Mexico","Award rendered on December 16, 2002, attached to the award is a Dissenting Opinion by one of the arbitrators.",2002
UNC523,"Marfin Investment Group Holdings S.A., Alexandros Bakatselos and others v. Republic of Cyprus",ARB/13/27,Banking enterprise,2013-09-27,Bernard HANOTIAU,YES,Belgian,Daniel M. PRICE,YES,U.S.,David A.O. EDWARD,YES,British,"Three Crowns, Paris, France Marfin Investment Group Holdings, Kifissia, Greece Tariq Baloch, London, U.K.","Skadden, Arps, Slate, Meagher & Flom, London, U.K. Chrysses Demetriades & Co., Limassol, Cyprus",,
UNC522,Karkey Karadeniz Elektrik Uretim A.S. v. Islamic Republic of Pakistan,ARB/13/1,Power generation equipment,2013-02-08,Yves DERAINS,YES,French,Horacio A. GRIGERA NAÓN,YES,Argentine,David A.O. EDWARD,YES,British,"Arnold & Porter, Washington, D.C., U.S.A. Hassan Kaunain Nafees, Islamabad, Pakistan","Allen & Overy, London, U.K.",,
UNC239,Occidental Petroleum Corporation and Occidental Exploration and Production Company v. Republic of Ecuador,ARB/06/11,Hydrocarbon concession,2006-07-13,L. Yves FORTIER,YES,Canadian,Brigitte STERN,YES,French,David A.R. WILLIAMS,YES,New Zealand,"Debevoise & Plimpton, New York, NY, U.S.A. Covington & Burling, London, U.K.","Procurador General del Estado, Quito, Ecuador Squire, Sanders & Dempsey, Cleveland, OH, U.S.A. Dechert, Paris, France","Award rendered on October 5, 2012, attached to the award is a dissenting opinion by one of the arbitrators.",2012
,Sudapet Company Limited v. Republic of South Sudan,ARB/12/26,Exploration and production of hydrocarbons,2012-08-29,Campbell Alan McLACHLAN,YES,New Zealand,Gavan GRIFFITH,YES,Australian,David A.R. WILLIAMS,YES,New Zealand,"S&A Law Firm (in association with SNR Denton), Ruwi, Sultanate of Oman	 Alexander Layton, London, U.K. Lucas Bastin, London, U.K.","Skadden, Arps, Slate, Meagher & Flom, London, U.K.",,
UNC337,"Mærsk Olie, Algeriet A/S v. People's Democratic Republic of Algeria",ARB/09/14,Exploration and production of liquid hydrocarbons,2009-07-29,Gabrielle KAUFMANN-KOHLER,YES,Swiss,Kamal HOSSAIN,YES,Bangladeshi,David A.R. WILLIAMS,YES,New Zealand,"King & Spalding, Houston, TX, U.S.A.","Curtis, Mallet-Prevost, Colt & Mosle, New York, NY, U.S.A., Paris, France, Milan, Italy and Mexico City, Mexico Shearman & Sterling, Paris, France","The Tribunal issues a procedural order taking note of the discontinuance of the proceeding pursuant to ICSID Arbitration Rule 43(1) on September 30, 2013.",2013
UNC338,Deutsche Bank AG v. Democratic Socialist Republic of Sri Lanka,ARB/09/2,Hedging agreement,2009-03-24,Bernard HANOTIAU,YES,Belgian,Makhdoom Ali KHAN,YES,Pakistani,David A.R. WILLIAMS,YES,New Zealand,"Allen & Overy, Hong Kong, China Julius & Creasy, Colombo, Sri Lanka","Attorney General James Crawford, Clive Freedman, Ali Malek, and Simon Olleson, London, U.K.","Award rendered on October 31, 2012, attached to the award is a dissenting opinion by arbitrator Makhdoom Ali Khan.",2012
UNC379,"Border Timbers Limited, Timber Products International (Private) Limited, and Hangani Development Co. (Private) Limited v. Republic of Zimbabwe",ARB/10/25,Forestry and timber processing enterprises,2010-12-20,L. Yves FORTIER,YES,Canadian,Michael HWANG,YES,Singaporean,David A.R. WILLIAMS,YES,New Zealand,"Steptoe & Johnson, London, U.K. Wiley Rein, Washington, D.C., U.S.A.","Attorney General Kimbrough & Associés, Paris, France","Award rendered by the Tribunal on July 28, 2015.",2015
UNC378,Bernhard von Pezold and others v. Republic of Zimbabwe,ARB/10/15,Commercial farms,2010-07-08,L. Yves FORTIER,YES,Canadian,Michael HWANG,YES,Singaporean,David A.R. WILLIAMS,YES,New Zealand,"Steptoe & Johnson, London, U.K. Wiley Rein, Washington, D.C., U.S.A.","Attorney General Kimbrough & Associés, Paris, France","Award rendered by the Tribunal on July 28, 2015.",2015
UNC482,"Ping An Life Insurance Company of China, Limited and Ping An Insurance (Group) Company of China, Limited v. Kingdom of Belgium",ARB/12/29,Banking and financial services,2012-09-19,Lawrence COLLINS,YES,British,Philippe SANDS,YES,"British, French",David A.R. WILLIAMS,YES,New Zealand,"Kirkland & Ellis International, London, U.K. and Chicago, IL, U.S.A. Paul Key, London, U.K. James Crawford, London, U.K.","Monsieur le Vice Premier Ministre et Ministre des Finances, Kingdom of Belgium, Brussels, Belgium Service Public F&eacuted&eacuteral Finances, Administration G&eacuten&eacuterale de la Tr&eacutesorerie, Kingdom of Belgium, Brussels, Belgium Liedekerke WoltersWaelbroeckKirkpatrick, Brussels, Belgium","Award rendered by the Tribunal on April 30, 2015.",2015
UNC334,Gold Reserve Inc. v. Bolivarian Republic of Venezuela,ARB(AF)/09/1,Mining company,2009-11-09,Piero BERNARDINI,YES,Italian,Pierre-Marie DUPUY,YES,French,David A.R. WILLIAMS,YES,New Zealand,,,"Award rendered on September 22, 2014.",2014
UNC449,Nova Scotia Power Incorporated v. Bolivarian Republic of Venezuela,ARB(AF)/11/1,Coal supply agreement,2011-01-26,Hans VAN HOUTTE,YES,Belgian,Raúl E. VINUESA,YES,"Spanish, Argentine",David A.R. WILLIAMS,YES,New Zealand,"Torys, Toronto, Canada","Procuradora General de la República, Caracas, Venezuela Foley Hoag, Washington, D.C., U.S.A.","Award rendered on April 30, 2014.",2014
,RSM Production Corporation v. Grenada,ARB/05/14,Oil exploration contract,2005-08-05,V.V. VEEDER,YES,British,Bernard AUDIT,YES,French,David BERRY,YES,"U.S., Canadian","President & CEO, RSM Production Corporation, Denver, CO, U.S.A.","Language(s) of Proceeding;English;Status of Proceeding;Concluded;Outcome of Proceeding;Award rendered on March 13, 2009.;(b) Annulment Proceeding;Applicant(s)/Requesting Party(ies);Claimant(s);Respondent(s) on Annulment;Date Registered;July 10, 2009 (Claimant(s));Date of Constitution of ad hoc Committee;August 17, 2009;Composition of ad hoc Committee (Appointed by the Chairman of the Administrative Council);President;Gavan GRIFFITH (Australian);Members;Cecil W.M. ABRAHAM (Malaysian) Campbell Alan McLACHLAN (New Zealand);Initial Composition of ad hoc Committee;President;Members;Reconstituted;Party Representatives;Claimant(s): President & CEO, RSM Production Corporation, Denver, CO, U.S.A.","Award rendered on March 13, 2009.",2009
,Maritime International Nominees Establishment v. Republic of Guinea,ARB/84/4,Bauxite transportation joint venture,1984-09-18,Donald E. ZUBROD,YES,U.S.,Jack BERG,YES,U.S.,David K. SHARPE,YES,U.S.,"Kaplan Russin & Vecchi, Washington, D.C., U.S.A.","Cadwalader, Wickersham & Taft, Washington, D.C., U.S.A.","Award rendered on January 6, 1988.",1988
UNC055,Mihaly International Corporation v. Democratic Socialist Republic of Sri Lanka,ARB/00/2,Power project,2000-01-11,Sompong SUCHARITKUL,YES,Thai,Andrew ROGERS,YES,Australian,David SURATGAR,YES,British,"Burnet, Duckworth & Palmer, Calgary, Alberta, Canada","Morgan, Lewis & Bockius, New York, NY, U.S.A.","Award rendered on March 15, 2002, attached to the award is a Concurring Opinion by one of the arbitrators.",2002
UNC077,Siemens A.G. v. Argentine Republic,ARB/02/8,Informatic services contract,2002-07-17,Andrés RIGO SUREDA,YES,Spanish,Charles N. BROWER,YES,U.S.,Domingo BELLO JANEIRO,YES,Spanish,"M. & M. Bomchil, Buenos Aires, Argentina Peter Gnam, Feldafing, Germany","Language(s) of Proceeding;Spanish, English;Status of Proceeding;Concluded;Outcome of Proceeding;Award rendered on February 6, 2007.;(b) Annulment Proceeding;Applicant(s)/Requesting Party(ies);Respondent(s);Respondent(s) on Annulment;Date Registered;July 16, 2007 (Respondent(s));Date of Constitution of ad hoc Committee;October 4, 2007;Composition of ad hoc Committee (Appointed by the Chairman of the Administrative Council);President;Gilbert GUILLAUME (French);Members;Florentino P. FELICIANO (Philippine) Mohamed SHAHABUDDEEN (Guyanese);Initial Composition of ad hoc Committee;President;Members;Reconstituted;Party Representatives;Claimant(s): M. & M. Bomchil, Buenos Aires, Argentina Peter Gnam, Feldafing, Germany","Award rendered on February 6, 2007.",2007
UNC184,Daimler Financial Services AG v. Argentine Republic,ARB/05/1,Leasing and financial services,2005-01-14,Pierre-Marie DUPUY,YES,French,Charles N. BROWER,YES,U.S.,Domingo BELLO JANEIRO,YES,Spanish,"Kelly Drye & Warren, New York, NY, U.S.A.","Procuradora del Tesoro de la Naci&oacuten, Buenos Aires, Argentina","The Tribunal renders its award, attached to the award is a dissenting opinion by arbitrator Charles N. Brower and a separate opinion by arbitrator Domingo Bello Janeiro.",
UNC084,AES Corporation v. Argentine Republic,ARB/02/17,Electricity generation and distribution operations,2002-12-19,Pierre-Marie DUPUY,YES,French,Karl-Heinz BÖCKSTIEGEL,YES,German,Domingo BELLO JANEIRO,YES,Spanish,"General Counsel, AES Corparation North America, Arlington, VA, U.S.A. Chaffetz Lindsey, New York, NY, U.S.A.","Procuradora del Tesoro de la Naci&oacuten, Buenos Aires, Argentina",,
UNC200,"African Holding Company of America, Inc. and Société Africaine de Construction au Congo S.A.R.L. v. Democratic Republic of the Congo",ARB/05/21,Construction contracts,2005-10-27,Francisco ORREGO VICUÑA,YES,Chilean,Otto L.O. DE WITT WIJNEN,YES,Dutch,Dominique GRISAY,YES,Belgian,"Debevoise & Plimpton, New York, NY, U.S.A., and Paris, France Law Office of David A. Saltman, Ponte Vedra, FL, U.S.A.","Ministre de la Justice et Garde des Sceaux, Kinshasa, Democratic Republic of the Congo Cabinet Kikangala & Associés, Brussels, Belgium","Award rendered on July 29, 2008, attached to the award is a dissenting opinion by one of the arbitrators.",2008
