ID,Case Title,Case Number,InvestmentType,Date Registered,Arbitrator1,Arbitrator1President,President Nationality,Arbitrator2,Arbitrator2Claimant,Arbitrators 1 Nationality,Arbitrator3,Arbitrator3Respondent,Arbitrator 2 Nationality,Claimant Representative,Respondent Representative,Outcome Of Proceeding,ResolutionYear
UNC116,Camuzzi International S.A. v. Argentine Republic,ARB/03/2,Gas supply and distribution enterprise,2003-02-27,Francisco ORREGO VICUÑA,YES,Chilean,Marc LALONDE,YES,Canadian,Sandra MORELLI RICO,YES,Colombian,"Estudio Moltedo, Buenos Aires, Argentina","Procuradora del Tesoro de la Naci&oacuten, Buenos Aires, Argentina",,
UNC088,Sempra Energy International v. Argentine Republic,ARB/02/16,Gas supply and distribution enterprise,2002-12-06,Francisco ORREGO VICUÑA,YES,Chilean,Marc LALONDE,YES,Canadian,Sandra MORELLI RICO,YES,Colombian,"King & Spalding, Houston, TX, U.S.A.","Language(s) of Proceeding;Spanish, English;Status of Proceeding;Concluded;Outcome of Proceeding;Decision on Application for Annulment issued on June 29, 2010.;(c) Resubmission Proceeding;Applicant(s)/Requesting Party(ies);Claimant(s);Respondent(s);Date Registered;November 12, 2010 (Claimant(s));Date of Constitution of Tribunal;April 21, 2011;Composition of Tribunal;President;Vaughan LOWE (British) - Appointed by the Parties;Arbitrators;Kamal HOSSAIN (Bangladeshi) - Appointed by the Respondent(s) David A.R. WILLIAMS (New Zealand) - Appointed by the Claimant(s);Initial Composition of Tribunal;President;Arbitrators;Reconstituted;Party Representatives;Claimant(s): King & Spalding, Houston, TX, U.S.A.","Award rendered on September 28, 2007, attached to the award is a partial dissenting opinion by one of the arbitrators.",2007
UNC501,Transban Investments Corp. v. Bolivarian Republic of Venezuela,ARB/12/24,Vehicle import enterprise,2012-08-27,Peter TOMKA,YES,Slovak,David D. CARON,YES,U.S.,Santiago TORRES BERNÁRDEZ,YES,Spanish,"DLA Piper, Miami, FL, U.S.A.","Procuraduría General de la República, Caracas, Venezuela Guglielmino & Asociados, Buenos Aires, Argentina",,
UNC320,Ambiente Ufficio S.p.A. and others v. Argentine Republic,ARB/08/9,Debt instruments,2008-07-28,Bruno SIMMA,YES,"German, Austrian",Karl-Heinz BÖCKSTIEGEL,YES,German,Santiago TORRES BERNÁRDEZ,YES,Spanish,"Piero Parodi, Milan, Italy ARBLIT, Milan, Italy Rodolfo Carlos Barra, Buenos Aires, Argentina","Procuradora del Tesoro de la Nación, Buenos Aires, Argentina","Order for the discontinuance of the proceeding for lack of payment of the required advances, pursuant to ICSID Administrative and Financial Regulation 14(3)(d), issued on May, 8, 2015, attached to the order is an individual statement by arbitrator Santiago Torres Bernárdez.",2015
UNC605,Casinos Austria International GmbH and Casinos Austria Aktiengesellschaft v. Argentine Republic,ARB/14/32,Gaming industry,2014-12-18,Hans VAN HOUTTE,YES,Belgian,Stephan SCHILL,YES,German,Santiago TORRES BERNÁRDEZ,YES,Spanish,"Wolf Theiss Rechtsanwälte GmbH & Co KG, Vienna, Austria","Procuradora del Tesoro de la Nación, Buenos Aires, Argentina",,
,Zhinvali Development Ltd. v. Republic of Georgia,ARB/00/1,Rehabilitation of a hydropower plant,2000-01-07,Davis R. ROBINSON,YES,U.S.,Andreas J. JACOVIDES,YES,Cypriot,Seymour J. RUBIN,YES,U.S.,"Zhinvali Development Limited, Megaron Lavinia, Nicosia, Cyprus Patterson, Belknap, Webb & Tyler, New York, NY, U.S.A.","Norton Rose London, U.K. Mgaloblishvili, Kipiani, Dzidziguri (MKD), Tbilisi, Georgia Tbilisi City Government, Tbilisi, Georgia","Award rendered on January 24, 2003, attached to the award is a separate opinion by one of the arbitrators.",2003
,Ali Alyafei v. Hashemite Kingdom of Jordan,ARB/15/24,Acquisition of shares,2015-06-11,Karl-Heinz BÖCKSTIEGEL,YES,German,Stephan SCHILL,YES,German,Siegfried H. ELSING,YES,German,"Gentium Law Group Sàrl, Geneva, Switzerland","Homburger AG, Zurich, Switzerland Dajani & Associates, Amman, Jordan Dr. Anis F. Kassim, Amman, Jordan",,
,"Churchill Mining and Planet Mining Pty Ltd, formerly ARB/12/14 v. Republic of Indonesia",ARB/12/14 and 12/40,Coal mining project,2012-06-22,Gabrielle KAUFMANN-KOHLER,YES,Swiss,Albert Jan VAN DEN BERG,YES,Dutch Michael HWANG,Singaporean,YES,,"Clifford Chance, Perth, Australia, Hong Kong SAR, China, Singapore, Singapore, and London, U.K.","Minister of Law and Human Rights, Jakarta, Indonesia Didi Dermawan, Jakarta, Indonesia DNC Advocates at Work, Jakarta, Indonesia",,
UNC247,Alpha Projektholding GmbH v. Ukraine,ARB/07/16,Hotel development project,2007-07-25,Davis R. ROBINSON,YES,U.S.,Yoram A. TURBOWICZ,YES,Israeli,Stanimir A. ALEXANDROV,YES,Bulgarian,"Specht Rechtsanwalt GmbH, Vienna, Austria Sullivan & Worcester, Boston, MA, U.S.A.","Ministry of Justice, Kiev, Ukraine Grischenko & Partners, Kiev, Ukraine Proxen & Partners, Kiev, Ukraine","Award rendered on November 8, 2010.",2010
,Mobil Oil Corporation and others v. New Zealand,ARB/87/2,Synthetic fuels project,1987-04-15,Graham SPEIGHT,YES,New Zealand,Maureen BRUNT,YES,Australian,Stephen CHARLES,YES,Australian,"Russell McVeagh McKenzie Bartleet & Co., Wellington, New Zealand","Perry Castle of Wellington, New Zealand","Settlement agreed by the parties and proceeding discontinued at their request (Order taking note of the discontinuance issued by the Tribunal on November 26, 1990 pursuant to Arbitration Rule 43(1)).",1990
UNC083,Hussein Nuaman Soufraki v. United Arab Emirates,ARB/02/7,Concession agreement regarding a port,2002-06-18,L. Yves FORTIER,YES,Canadian,Aktham EL KHOLY,YES,Egyptian,Stephen M. SCHWEBEL,YES,U.S.,"Freshfields Bruckhaus Deringer, New York, NY, U.S.A., and Paris, France","Allen & Overy, London, U.K. and Dubai, United Arab Emirates","Award rendered on July 7, 2004.",2004
UNC457,"Novera AD, Novera Properties B.V. and Novera Properties N.V. v. Republic of Bulgaria",ARB/12/16,Waste management services,2012-07-03,John M. TOWNSEND,YES,U.S.,David D. CARON,YES,U.S.,Stephen M. SCHWEBEL,YES,U.S.,"King & Spalding, New York, NY, U.S.A.","Minister of Finances, Sofia, Bulgaria White & Case, New York, NY, and Washington, D.C., U.S.A. Tomov & Tomov, Sofia, Bulgaria","Award rendered by the Tribunal on August 27, 2015.",2015
,Fondel Metal Participations B.V. v. Republic of Azerbaijan,ARB/07/1,Aluminium and alumina production company,2007-01-09,David A.R. WILLIAMS,YES,New Zealand,J. William ROWLEY,YES,"British, Canadian",Stephen M. SCHWEBEL,YES,U.S.,"Clyde & Co., London, U.K. Toby Landau, London, U.K.","Ministry of Economic Development, Baku, Azerbaijan State Committee for Management of State Property, Baku, Azerbaijan Allen & Overy, London, U.K.","Settlement agreed by the parties and proceeding discontinued at their request (Order taking note of the discontinuance issued by the Tribunal on January 23, 2009 pursuant to Arbitration Rule 43(1)).",2009
UNC040,Mondev International Ltd. v. United States of America,ARB(AF)/99/2,Commercial real estate development,1999-09-20,Ninian STEPHEN,YES,Australian,James R. CRAWFORD,YES,Australian,Stephen M. SCHWEBEL,YES,U.S.,"White & Case, Washington, D.C., U.S.A. Hale and Dorr, Boston, MA, U.S.A. Arthur Watts, Chambers of Ian Milligan, Esq., QC, London, U.K.","Chief, NAFTA Arbitration Division, Office of International Claims and Investment Disputes, Office of the Legal Adviser (L/CID), Washington, D.C., U.S.A.","Award rendered on October 11, 2002.",2002
UNC525,Güneş Tekstil Konfeksiyon Sanayi ve Ticaret Limited Şirketi and others v. Republic of Uzbekistan,ARB/13/19,Retail enterprise,2013-08-29,Hans VAN HOUTTE,YES,Belgian,Eric SCHWARTZ,YES,"U.S., French",Teresa GIOVANNINI,YES,Swiss,"Akinci Law Office, Istanbul, Turkey","White and Case, Washington, D.C. Ministry of Justice, Tashkent, Uzbekistan",,
,Carnegie Minerals (Gambia) Limited v. Republic of The Gambia,ARB/09/19,Mining concession,2009-10-23,Donald DONOVAN,YES,U.S.,Jean Engelmayer KALICKI,YES,U.S.,the Secretary-General Philippe PINSOLLE,YES,French,"Clyde & Co, London, U.K.","Office of the President State House, Banjul, The Gambia Mayer Brown Rowe & Maw, Paris, France","Award rendered by the Tribunal on July 14, 2015.",2015
UNC407,Mobile TeleSystems OJSC v. Turkmenistan,ARB(AF)/11/4,Telecommunications enterprise,2011-10-05,Campbell Alan McLACHLAN,YES,New Zealand,Michael C. PRYLES,YES,Australian,Thomas BUERGENTHAL,YES,U.S.,"White & Case, London, U.K.","President of Turkmenistan, Ashgabat, Turkmenistan Curtis, Mallet-Prevost, Colt & Mosle, Washington, D.C. and New York, NY, U.S.A. and Istanbul, Turkey","The Tribunal issues a procedural order taking note of the discontinuance of the proceeding pursuant to ICSID Arbitration (Additional Facility) Rule 49(1) on September 21, 2012.",2012
UNC366,"UAB ""ARVI"" ir ko and UAB ""SANITEX"" v. Republic of Serbia",ARB/09/21,Fertilizer plant,2009-12-18,Thomas BUERGENTHAL,YES,U.S.,Charles N. BROWER,YES,U.S.,Tibor VARADY,YES,Serbian,"Hughes Hubbard & Reed, Paris, France Bernotas & Dominas Glimstedt, Vilnius, Lithuania","Public Attorney of the Republic of Serbia, Belgrade, Serbia Sanja Djajic, Novi Sad, Serbia Miroslav Paunovic, Radomir Milosevic, Milos Zivkovic, Belgrade, Serbia","Award rendered by the Tribunal on March 16, 2015, attached to the award is a separate opinion by arbitrator Charles N. Brower.",2015
UNC260,Gustav F W Hamester GmbH & Co KG v. Republic of Ghana,ARB/07/24,Cocoa production enterprise,2007-09-24,Brigitte STERN,YES,French,Bernardo M. CREMADES,YES,Spanish,Toby LANDAU,YES,British,"AFA Law, Cheam Surrey, U.K. Andrew Goddardd, Riaz Hussain, London, U.K.","Attorney-General and Minister for Justice, Accra, Ghana Dewey & LeBoeuf, London, U.K.","Award rendered on June 18, 2010.",2010
UNC113,Impregilo S.p.A. v. Islamic Republic of Pakistan,ARB/03/3,Hydropower project,2003-03-03,Gilbert GUILLAUME,YES,French,Bernardo M. CREMADES,YES,Spanish,Toby LANDAU,YES,British,"Sidley Austin Brown & Wood, Washington, D.C., U.S.A. Bonelli Erede Pappalardo, Milan, Italy","Attorney General of Pakistan, Islamabad, Pakistan Bhandari, Naqvi & Riaz, Lahore, Pakistan Eversheds, Paris, France","Settlement agreed by the parties and proceeding discontinued at the request of the Claimant (Order taking note of the discontinuance issued by the Tribunal pursuant to ICSID Arbitration Rule 44 on September 26, 2005).",2005
UNC422,"Hussain Sajwani, Damac Park Avenue for Real Estate Development S.A.E., and Damac Gamsha Bay for Development S.A.E. v. Arab Republic of Egypt",ARB/11/16,Property development projects,2011-06-20,Pierre TERCIER,YES,Swiss,Daniel M. PRICE,YES,U.S.,Toby LANDAU,YES,British,"Clifford Chance, London, UK and Dubai, United Arab Emirates","Egyptian State Lawsuits Authority Shearman & Sterling, Paris, France","Order taking note of the discontinuance of the proceeding pursuant to ICSID Arbitration Rule 44 issued on September 10, 2014.",2014
UNC203,Biwater Gauff (Tanzania) Limited v. United Republic of Tanzania,ARB/05/22,Water and sewer services concession agreement,2005-11-02,Bernard HANOTIAU,YES,Belgian,Gary B. BORN,YES,U.S.,Toby LANDAU,YES,British,"Allen & Overy, London, U.K.","Mkono & Co, Dar es Salaam, Tanzania Freshfields Bruckhaus Deringer, Amsterdam, Netherlands","Award rendered on July 24, 2008, attached to the award is a concurring and dissenting opinion by one of the arbitrators.",2008
UNC534,"Lieven J. van Riet, Chantal C. van Riet and Christopher van Riet v. Republic of Croatia",ARB/13/12,Tourism facilities,2013-06-21,Karl-Heinz BÖCKSTIEGEL,YES,German,Ibrahim FADLALLAH,YES,"French, Lebanese",Toby LANDAU,YES,British,"Derains & Gharavi, Paris, France","Latham & Watkins, Hamburg, Germany and London, U.K. E&A Law Limited, London, U.K.",,
,Cambodia Power Company v. Kingdom of Cambodia,ARB/09/18,Electricity generation and distribution operations,2009-09-16,Neil KAPLAN,YES,British,John BEECHEY,YES,British,Toby LANDAU,YES,British,"Macmillan Keck, New York, NY, U.S.A. Starr & Partners, London, U.K. William Frain-Bell, Hardwicke Chambers, London, U.K.","Freshfields Bruckhaus Deringer, Paris, France","Award rendered on April 22, 2013.",2013
UNC421,Tenaris S.A. and Talta - Trading e Marketing Sociedade Unipessoal Lda. v. Bolivarian Republic of Venezuela,ARB/11/26,Hot briquetted iron production plant,2011-09-30,John BEECHEY,YES,British,Judd L. KESSLER,YES,U.S.,Toby LANDAU,YES,British,"Freshfields Bruckhaus Deringer, Washington, D.C., U.S.A. and Rome, Italy","Procuradur&iacutea General de la Rep&uacuteblica, Caracas, Venezuela Foley Hoag, Washington, D.C., U.S.A.",,
UNC535,Vladislav Kim and others v. Republic of Uzbekistan,ARB/13/6,Cement production enterprise,2013-04-24,David D. CARON,YES,U.S.,L. Yves FORTIER,YES,Canadian,Toby LANDAU,YES,British,"Jones Day, London, U.K.","Government of the Republic of Uzbekistan White & Case, Washington, D.C., U.S.A.",,
UNC420,"The Renco Group, Inc. v. Republic of Peru",UNCT/13/1,Mining company,,Michael J. MOSER,YES,Austrian,L. Yves FORTIER,YES,Canadian,Toby LANDAU,YES,British,"King & Spalding, New York, NY and Houston, TX, U.S.A.","White & Case, Washington, D.C., U.S.A. Estudio Echecopar, Lima, Peru",,
UNC133,Plama Consortium Limited v. Republic of Bulgaria,ARB/03/24,Oil refinery,2003-08-19,Carl F. SALANS,YES,U.S.,Albert Jan VAN DEN BERG,YES,Dutch,V.V. VEEDER,YES,British,"Nixon Peabody, New York, NY, U.S.A. Denev & Oysolov Law Office, Sofia, Bulgaria","Head of the Judicial Protection of the Ministry of Finance, Sofia, Bulgaria White & Case, New York, NY, and Washington, D.C., U.S.A. Tomov & Tomov, Sofia, Bulgaria","Award rendered on August 27, 2008.",2008
UNC563,Federal Elektrik Yatırım ve Ticaret A.Ş. and others v. Republic of Uzbekistan,ARB/13/9,Renovation and development of natural gas system,2013-05-24,Laurent LÉVY,YES,"Swiss, Brazilian",Jan PAULSSON,YES,"Bahraini, Swedish, French",V.V. VEEDER,YES,British,"Akinci Law Office, Istanbul, Turkey Jones Day, London, U.K.","Government of the Republic of Uzbekistan White & Case, Washington, D.C., U.S.A.",,
UNC481,Marco Gavazzi and Stefano Gavazzi v. Romania,ARB/12/25,Steel production enterprise,2012-08-27,Hans VAN HOUTTE,YES,Belgian,Mauro RUBINO-SAMMARTANO,YES,Italian,V.V. VEEDER,YES,British,"Giorgio Sacerdoti and Anna De Luca, Milano, Italy","Authority for State Assets Administration (AAAS), Bucharest, Romania S.C.P. Cobuz Si Asociatii, Bucharest, Romania S.P.R.L. Bostina Si Asociatii, Bucharest, Romania",,
UNC269,Ron Fuchs v. Georgia,ARB/07/15,Oil and gas distribution enterprise,2007-07-16,L. Yves FORTIER,YES,Canadian,Francisco ORREGO VICUÑA,YES,Chilean,Vaughan LOWE,YES,British,"Dewey LeBoeuf, London, U.K. and Washington, D.C., U.S.A.","Language(s) of Proceeding;English;Status of Proceeding;Concluded;Outcome of Proceeding;Award rendered on March 3, 2010.;(b) Annulment Proceeding;Applicant(s)/Requesting Party(ies);Respondent(s);Respondent(s) on Annulment;Date Registered;July 16, 2010 (Respondent(s));Date of Constitution of ad hoc Committee;August 11, 2010;Composition of ad hoc Committee (Appointed by the Chairman of the Administrative Council);President;Dominique HASCHER (French);Members;Cecil W.M. ABRAHAM (Malaysian) Karl-Heinz BÖCKSTIEGEL (German);Initial Composition of ad hoc Committee;President;Members;Reconstituted;Party Representatives;Claimant(s): Dewey LeBoeuf, London, U.K. and Washington, D.C., U.S.A.","Award rendered on March 3, 2010.",2010
UNC204,Ioannis Kardassopoulos v. Georgia,ARB/05/18,Oil and gas distribution enterprise,2005-10-03,L. Yves FORTIER,YES,Canadian,Francisco ORREGO VICUÑA,YES,Chilean,Vaughan LOWE,YES,British,"Dewey LeBoeuf, London, U.K. and Washington, D.C., U.S.A.","Language(s) of Proceeding;English;Status of Proceeding;Concluded;Outcome of Proceeding;Award rendered on March 3, 2010.;(b) Annulment Proceeding;Applicant(s)/Requesting Party(ies);Respondent(s);Respondent(s) on Annulment;Date Registered;July 16, 2010 (Respondent(s));Date of Constitution of ad hoc Committee;August 11, 2010;Composition of ad hoc Committee (Appointed by the Chairman of the Administrative Council);President;Dominique HASCHER (French);Members;Cecil W.M. ABRAHAM (Malaysian) Karl-Heinz BÖCKSTIEGEL (German);Initial Composition of ad hoc Committee;President;Members;Reconstituted;Party Representatives;Claimant(s): Dewey LeBoeuf, London, U.K. and Washington, D.C., U.S.A.","Award rendered on March 3, 2010.",2010
UNC584,Zelena N.V. and Energo-Zelena d.o.o Inđija v. Republic of Serbia,ARB/14/27,Waste management services,2014-11-07,Bruno SIMMA,YES,"German, Austrian",Karl-Heinz BÖCKSTIEGEL,YES,German,Vaughan LOWE,YES,British,"Schönherr Rechtsanwälte GmbH, Vienna, Austria Moravčevic Vojnović i Partneri OAD, Belgrade, Serbia","Office of the State Attorney, Belgrade, Serbia",,
UNC415,Vigotop Limited v. Hungary,ARB/11/22,Resort development,2011-08-04,Klaus SACHS,YES,German,Doak BISHOP,YES,U.S.,Veijo HEISKANEN,YES,Finnish,"Volterra Fietta, London, U.K. Dr. Daisy Kiss & Partner Law Office, Budapest, Hungary Lakatos, Köves and Partners Ügyvdi Iroda, Budapest, Hungary","White & Case, New York, NY, U.S.A. White & Case, Paris, France R&eacuteczicza White & Case, Budapest, Hungary","Award rendered on October 1, 2014.",2014
UNC335,"H&H Enterprises Investments, Inc. v. Arab Republic of Egypt",ARB/09/15,Resort management and operation,2009-08-11,Bernardo M. CREMADES,YES,Spanish,Hamid G. GHARAVI,YES,"Iranian, French",Veijo HEISKANEN,YES,Finnish,"Esquire International Legal Advisors, San Diego, CA, U.S.A.","Language(s) of Proceeding;English;Status of Proceeding;Concluded;Outcome of Proceeding;Award rendered on May 6, 2014.;(b) Annulment Proceeding;Applicant(s)/Requesting Party(ies);Claimant(s);Respondent(s) on Annulment;Date Registered;September 17, 2014 (Claimant(s));Date of Constitution of ad hoc Committee;October 23, 2014;Composition of ad hoc Committee (Appointed by the Chairman of the Administrative Council);President;Stanimir A. ALEXANDROV (Bulgarian);Members;Cecil W.M. ABRAHAM (Malaysian) Teresa CHENG (Chinese);Initial Composition of ad hoc Committee;President;Members;Reconstituted;Party Representatives;Claimant(s): Esquire International Legal Advisors, San Diego, CA, U.S.A.","Award rendered on May 6, 2014.",2014
UNC307,"ATA Construction, Industrial and Trading Company v. Hashemite Kingdom of Jordan",ARB/08/2,Waterway construction project,2008-02-28,L. Yves FORTIER,YES,Canadian,Ahmed Sadek EL-KOSHERI,YES,Egyptian,W. Michael REISMAN,YES,U.S.,"Latham & Watkins, London, U.K. Nurhan Motugan, Istanbul, Turkey","Covington & Burling, Washington, D.C., U.S.A. Rabie Hamzeh, Amman, Jordan","Award rendered on May 18, 2010.",2010
UNC234,Spyridon Roussalis v. Romania,ARB/06/1,Food trading company,2006-01-10,Bernard HANOTIAU,YES,Belgian,Andrea GIARDINA,YES,Italian,W. Michael REISMAN,YES,U.S.,"Doru Costea Law Office, Bucharest, Romania Global Arbitration Litigation Services Ltd., London, U.K.","Winston & Strawn, Washington, D.C., U.S.A. CMS Cameron McKenna SCA, Washington, D.C., U.S.A.","The Tribunal renders its award on December 7, 2011, attached to the award is a separate opinion by arbitrator W. Michael Reisman.",2011
UNC125,Fraport AG Frankfurt Airport Services Worldwide v. Republic of the Philippines,ARB/03/25,Construction of an airport terminal,2003-10-09,L. Yves FORTIER,YES,Canadian,Bernardo M. CREMADES,YES,Spanish,W. Michael REISMAN,YES,U.S.,"Milbank, Tweed, Hadley & McCloy, Washington, D.C., U.S.A. Shulman, Rogers, Gandal, Pordy & Ecker, Potomac, MD, U.S.A. K&L Gates, Paris, France","Language(s) of Proceeding;English;Status of Proceeding;Concluded;Outcome of Proceeding;Award rendered on August 16, 2007, attached to the award is a Dissenting Opinion by one of the arbitrators.;(b) Annulment Proceeding;Applicant(s)/Requesting Party(ies);Claimant(s);Respondent(s) on Annulment;Date Registered;January 8, 2008 (Claimant(s));Date of Constitution of ad hoc Committee;April 14, 2008;Composition of ad hoc Committee (Appointed by the Chairman of the Administrative Council);President;Peter TOMKA (Slovak);Members;Dominique HASCHER (French) Campbell Alan McLACHLAN (New Zealand);Initial Composition of ad hoc Committee;President;Members;Reconstituted;Party Representatives;Claimant(s): Milbank, Tweed, Hadley & McCloy, Washington, D.C., U.S.A. Shulman, Rogers, Gandal, Pordy & Ecker, Potomac, MD, U.S.A. K&L Gates, Paris, France","Award rendered on August 16, 2007, attached to the award is a Dissenting Opinion by one of the arbitrators.",2007
UNC211,"Empresa Eléctrica del Ecuador, Inc. (EMELEC) v. Republic of Ecuador",ARB/05/9,Electricity enterprise,2005-05-26,Bernardo SEPÚLVEDA AMOR,YES,Mexican,John H. ROONEY,YES,U.S.,W. Michael REISMAN,YES,U.S.,"Provost Umphrey, Beaumont, TX, U.S.A. Henry Sain Dahl, Charlottesville, VA, U.S.A.","Procurador General del Estado, Quito, Ecuador Cabezas y Wray Abogados, Quito, Ecuador Latham & Watkins, London, U.K.","Award rendered on June 2, 2009.",2009
UNC166,Sociedad Anónima Eduardo Vieira v. Republic of Chile,ARB/04/7,Fisheries company,2004-02-27,Claus VON WOBESER,YES,Mexican,Susana B. CZAR DE ZALDUENDO,YES,Argentine,W. Michael REISMAN,YES,U.S.,"Estudio Vinuesa & Asociados, Buenos Aires, Argentina","Language(s) of Proceeding;Spanish;Status of Proceeding;Concluded;Outcome of Proceeding;Award rendered on August 21, 2007, attached to the award is a Dissenting Opinion by one of the arbitrators.;(b) Annulment Proceeding;Applicant(s)/Requesting Party(ies);Claimant(s);Respondent(s) on Annulment;Date Registered;January 24, 2008 (Claimant(s));Date of Constitution of ad hoc Committee;May 1, 2008;Composition of ad hoc Committee (Appointed by the Chairman of the Administrative Council);President;Christer SÖDERLUND (Swedish);Members;Piero BERNARDINI (Italian) Eduardo SILVA ROMERO (Colombian, French);Initial Composition of ad hoc Committee;President;Members;Reconstituted;Party Representatives;Claimant(s): Estudio Vinuesa & Asociados, Buenos Aires, Argentina","Award rendered on August 21, 2007, attached to the award is a Dissenting Opinion by one of the arbitrators.",2007
UNC135,Joy Mining Machinery Limited v. Arab Republic of Egypt,ARB/03/11,Phosphate mining project,2003-06-02,Francisco ORREGO VICUÑA,YES,Chilean,C.G. WEERAMANTRY,YES,Sri Lanka,William Laurence CRAIG,YES,U.S.,,,"Award rendered on August 6, 2004.",2004
UNC258,Shell Nigeria Ultra Deep Limited v. Federal Republic of Nigeria,ARB/07/18,Hydrocarbon concession,2007-07-26,Juan FERNÁNDEZ-ARMESTO,YES,Spanish,Hamid G. GHARAVI,YES,"Iranian, French",William W. PARK,YES,"Swiss, U.S.","Clifford Chance, Amsterdam, Netherlands","Alegeh & Co, Abuja, Nigeria","The Tribunal issues an order taking note of the discontinuance of the proceeding pursuant to ICSID Arbitration Rule 43(1) on August 1, 2011.",2011
UNC405,Mamidoil Jetoil Greek Petroleum Products Societe Anonyme S.A. v. Republic of Albania,ARB/11/24,Oil storage and distribution project,2011-09-12,Rolf KNIEPER,YES,German,Steven A. HAMMOND,YES,U.S.,Yas BANIFATEMI,YES,"Iranian, French","Freshfields Bruckhaus Deringer, Paris, France","Language(s) of Proceeding;English;Status of Proceeding;Concluded;Outcome of Proceeding;Award rendered on March 30, 2015, attached to the award is a dissenting opinion by arbitrator Steven A. Hammond.;(b) Annulment Proceeding;Applicant(s)/Requesting Party(ies);Claimant(s);Respondent(s) on Annulment;Date Registered;August 3, 2015 (Claimant(s));Date of Constitution of ad hoc Committee;August 19, 2015;Composition of ad hoc Committee (Appointed by the Chairman of the Administrative Council);President;Donald M. McRAE (Canadian, New Zealand);Members;Doug JONES (Australian, Irish) August REINISCH (Austrian);Initial Composition of ad hoc Committee;President;Members;Reconstituted;Party Representatives;Claimant(s): Freshfields Bruckhaus Deringer, Paris, France","Award rendered on March 30, 2015, attached to the award is a dissenting opinion by arbitrator Steven A. Hammond.",2015
,Russell Resources International Limited and others v. Democratic Republic of the Congo,ARB/04/11,Mining concession,2004-04-06,Horacio A. GRIGERA NAÓN,YES,Argentine,Franklin BERMAN,YES,British,Yawovi AGBOYIBO,YES,Togolese,"Managing Director, Russell Resources International Limited, Belgrade, Serbia","Minister of Justice, Kinshasa, Democratic Republic of Congo Cabinet Tshibangu & Associés, Kinshasa, Democratic Republic of Congo","The Tribunal issues an order for the discontinuance of the proceeding on February 10, 2009, for lack of payment of the required advances, pursuant to ICSID Administrative and Financial Regulation 14(3)(d).",2009
UNC191,EDF (Services) Limited v. Romania,ARB/05/13,Duty free services,2005-07-29,Piero BERNARDINI,YES,Italian,Arthur W. ROVINE,YES,U.S.,Yves DERAINS,YES,French,"Wolf Theiss, Vienna, Austria","White & Case, Washington, D.C., U.S.A. Tuca Zbârcea & Asociatii, Bucharest, Romania","Award rendered on October 8, 2009, attached to the Award is a Dissenting Opinion by one of the arbitrators.",2009
UNC518,"Valores Mundiales, S.L. and Consorcio Andino S.L. v. Bolivarian Republic of Venezuela",ARB/13/11,Food products enterprise,2013-06-06,Eduardo ZULETA,YES,Colombian,Horacio A. GRIGERA NAÓN,YES,Argentine,Yves DERAINS,YES,French,"Covington & Burling, Washington, D.C., U.S.A. Gruma S.A.B. de C.V., Mexico City, Mexico Zobrist Law Group, Charlottesville, VA, U.S.A.","Procuraduria General de la República, Caracas, Venezuela Foley Hoag, Washington, D.C., U.S.A.",,
UNC409,Indorama International Finance Limited v. Arab Republic of Egypt,ARB/11/32,Textile enterprise,2011-12-02,Donald M. McRAE,YES,"Canadian, New Zealand",Christoph H. SCHREUER,YES,Austrian,Zachary DOUGLAS,YES,Australian,"Latham & Watkins, London, U.K. and Hamburg, Germany","The Egyptian State Lawsuits Authority, Cairo, Egypt Bredin Prat, Paris, France","The Tribunal issues a procedural order taking note of the discontinuance of the proceeding pursuant to ICSID Arbitration Rule 43(1) on July 2, 2015)",2015
